dp,url,cat,title,BN_status
0785197249,https://www.amazon.com/dp/0785197249/?aod=1,Books › Comics & Graphic Novels › Graphic Novels,"STAR WARS LEGENDS EPIC COLLECTION: THE EMPIRE VOL. 2 (Epic Collection: Star Wars): Ross, Dave, Wheatley, Doug, Wilkins, Dave, Stradley, Randy: 9780785197249: Amazon.com: Books",No button (0)
B003157X7E,https://www.amazon.com/dp/B003157X7E/?aod=1,Grocery & Gourmet Food › Pantry Staples › Dried Grains & Rice › Brown,Amazon.com : Kokumin life brown rice 160g ~ 10 pieces : Grocery & Gourmet Food,No button (0)
B07B9VBTZW,https://www.amazon.com/dp/B07B9VBTZW/?aod=1,Sports & Outdoors › Sports & Outdoor Recreation Accessories › Coach & Referee Gear › Uniforms & Apparel,Amazon.com: ADAMS USA Flag Officials FB Penalty with Ball Center Weight GD/Gold/Gold : Sports & Outdoors,Not added (1)
1539603105,https://www.amazon.com/dp/1539603105/?aod=1,Books › Literature & Fiction › Action & Adventure,"Amazon.com: Crocodile Isle: 9781539603108: Bird, E.D.: Books",
B08Y8FW72N,https://www.amazon.com/dp/B08Y8FW72N/?aod=1,Sports & Outdoors › Fan Shop › Sports Equipment › Golf Equipment › Golf Balls,"Amazon.com : Trust Aurora Blue,Crystal Urethane Covered, Reactive Core, 3 Piece Golf Ball, Soft & Elasticity Feel, Distance with Greenside Control (One Dozen) : Sports & Outdoors",This item cannot be shipped to your selected delivery location. Please choose a different delivery location. (1)
0738752894,https://www.amazon.com/dp/0738752894/?aod=1,Books › Religion & Spirituality › Occult & Paranormal,"The Secret Keys of Conjure: Unlocking... by Bogan, Chas",Not added (1)
B0752ZLB8V,https://www.amazon.com/dp/B0752ZLB8V/?aod=1,CDs & Vinyl › AutoRip,Amazon.com: 88 Tuned Dreams: CDs & Vinyl,
184149402X,https://www.amazon.com/dp/184149402X/?aod=1,Books › Literature & Fiction › Genre Fiction,Death Masks: Jim Butcher: 9781841494029: Amazon.com: Books,
0615996108,https://www.amazon.com/dp/0615996108/?aod=1,Books › Literature & Fiction › Poetry,World Healing ~ World Peace Volume II: a poetry anthology: William S. Peters: 9780615996103: Amazon.com: Books,
1535544368,https://www.amazon.com/dp/1535544368/?aod=1,Books › Literature & Fiction › Action & Adventure,"Amazon.com: For the Devil Has Come with Great Wrath: 9781535544368: Plant, Emma: Books",Added (1)
197424699X,https://www.amazon.com/dp/197424699X/?aod=1,Books › Science Fiction & Fantasy › Fantasy,"Die Hexe von Wickersham (German Edition): Rabe, Nina: 9781974246991: Amazon.com: Books",
B017RP2B5M,https://www.amazon.com/dp/B017RP2B5M/?aod=1,,Amazon.com: Options Belgian Chocolate Mint Instant Hot Chocolate Drink (220g) - Pack of 6 : Grocery & Gourmet Food,No button (0)
B076W429QK,https://www.amazon.com/dp/B076W429QK/?aod=1,Home & Kitchen › Seasonal Décor › Stockings & Holders,Amazon.com: Official Harry Potter Hogwarts Crest Christmas Stocking : Home & Kitchen,This item cannot be shipped to your selected delivery location. Please choose a different delivery location. (1)
0857668765,https://www.amazon.com/dp/0857668765/?aod=1,Books › Literature & Fiction › Action & Adventure,"Amazon.com: The Moonsteel Crown: 9780857668769: Deas, Stephen: Books",
285157776X,https://www.amazon.com/dp/285157776X/?aod=1,Books › Foreign Language Books › French,"Amazon.com: Images et symboles du rêve: Dictionnaire: 9782851577764: MOIR, TRISTANT-FREDER: Books",No button (0)
B0038QU116,https://www.amazon.com/dp/B0038QU116/?aod=1,,"Amazon.com | Pilsner Urquell Beer Mugs Set Of 2 Pieces Pint, 0.5 Litre Lined: Beer Glasses: Beer Glasses",Not added (1)
1645561216,https://www.amazon.com/dp/1645561216/?aod=1,Books › Christian Books & Bibles › Literature & Fiction,Amazon.com: Vexed 2: Twisted Faith (King Family): 9781645561217: Honey: Books,
B079W9FRLZ,https://www.amazon.com/dp/B079W9FRLZ/?aod=1,Beauty & Personal Care › Skin Care › Body › Cleansers › Body Washes,"Amazon.com : Every Man Jack Body Wash, Sandalwood 33.8-ounce Moisturizing : Beauty & Personal Care",No button (0)
1538734036,https://www.amazon.com/dp/1538734036/?aod=1,,"Amazon.com: A Minute to Midnight (An Atlee Pine Thriller, 2): 9781538734032: Baldacci, David: Books",
0142424935,https://www.amazon.com/dp/0142424935/?aod=1,Books › Teen & Young Adult › Science Fiction & Fantasy,"Amazon.com: Rift: 9780142424933: Cremer, Andrea: Books",
034545829X,https://www.amazon.com/dp/034545829X/?aod=1,,"Waking Up Screaming: Haunting Tales of Terror: Lovecraft, H. P.: 9780345458292: Amazon.com: Books",
B005LLZ3C8,https://www.amazon.com/dp/B005LLZ3C8/?aod=1,Grocery & Gourmet Food › Breads & Bakery › Cookies,Amazon.com: McVities Digestives 400g : Grocery & Gourmet Food,No button (0)
4873063159,https://www.amazon.com/dp/4873063159/?aod=1,Books › Foreign Language Books › Japanese,Amazon.com: 彼女の啼き声 (エンジェルコミックス): 9784873063157: unknown author: Books,No button (0)
B084RP7WGV,https://www.amazon.com/dp/B084RP7WGV/?aod=1,,"Amazon.com : Harney & Sons Organic Earl Grey Supreme Teabags, 50 Count : Grocery & Gourmet Food",Not added (1)
B0816J2SM6,https://www.amazon.com/dp/B0816J2SM6/?aod=1,Office Products › Office & School Supplies › Paper › Cards & Card Stock › Greeting Cards,Amazon.com : Card for youth ordination Basic Classic - Text Card - 11.6 x 16.6 cm : Office Products,No button (0)
B07NZXXZB2,https://www.amazon.com/dp/B07NZXXZB2/?aod=1,,Amazon.com: Samsung Galaxy S10 G973F Hybrid Dual SIM 128GB Unlocked GSM LTE Phone with Triple 12MP+12MP+16MP Rear Camera (International Variant/US Compatible LTE) - Prism White : Cell Phones & Accessories,Not added (1)
0345539966,https://www.amazon.com/dp/0345539966/?aod=1,"Books › Mystery, Thriller & Suspense › Thrillers & Suspense","Amazon.com: Thrice the Brinded Cat Hath Mew'd: A Flavia de Luce Novel: 9780345539960: Bradley, Alan: Books",No button (0)
B00LXUKPJ2,https://www.amazon.com/dp/B00LXUKPJ2/?aod=1,Movies & TV › Featured Categories › DVD,Amazon.com: Starship Troopers (Las Brigadas Del Espacio) [Internacional] (Import Movie) (European Format - Zone 2) [1997] : Movies & TV,Not added (2)
B0096G00DG,https://www.amazon.com/dp/B0096G00DG/?aod=1,,"Amazon.com : Augason Farms Freeze Dried Whole Raspberries #10 Can, 8 oz : Dried Fruits : Sports & Outdoors",No button (0)
B003KLROVY,https://www.amazon.com/dp/B003KLROVY/?aod=1,,"Amazon.com: NOW Supplements, Melatonin 5 mg, Free Radical Scavenger*, Healthy Sleep Cycle*, 180 Count (Pack of 1) : Health & Household",Not added (2)
B00BIXCR0E,https://www.amazon.com/dp/B00BIXCR0E/?aod=1,CDs & Vinyl › Pop,"CLARK,RHONDA - Rhonda Clark - Amazon.com Music",No button (0)
B07M7RLLW9,https://www.amazon.com/dp/B07M7RLLW9/?aod=1,,Amazon.com : Starbucks Blonde Roast K-Cup Coffee Pods — Sunrise Blend for Keurig Brewers — 6 boxes (60 pods total) : Everything Else,Not added (1)
B0027HV9TU,https://www.amazon.com/dp/B0027HV9TU/?aod=1,,"Amazon.com: True Aerial Wine Aerator Pourer Spout - Aerating Pourers for Wine Bottles, Clear: Wine Pourers: Home & Kitchen",Not added (1)
177053170X,https://www.amazon.com/dp/177053170X/?aod=1,Books › Literature & Fiction › Genre Fiction,"Grimenna: Blazevic, N. K.: 9781770531703: Amazon.com: Books",
404713824X,https://www.amazon.com/dp/404713824X/?aod=1,Books › Foreign Language Books › Japanese,Amazon.com: Garei: Enchained Spiritual Beast 1: 9784047138247: Hajime Segawa: Books,Added (1)
1439227829,https://www.amazon.com/dp/1439227829/?aod=1,Books › Christian Books & Bibles › Christian Living,"Neurotheology Reveals the Covert Bondage of Unforgiveness: Hill, Rosie M.: 9781439227824: Amazon.com: Books",This item cannot be shipped to your selected delivery location. Please choose a different delivery location. (1)
B0000A1ODP,https://www.amazon.com/dp/B0000A1ODP/?aod=1,,Amazon.com: Wilton White Icing Tube,This item cannot be shipped to your selected delivery location. Please choose a different delivery location. (1)
0062359347,https://www.amazon.com/dp/0062359347/?aod=1,,"The Dark Lord (Mysterium): Heckel, Jack: 9780062359346: Amazon.com: Books",
0986358053,https://www.amazon.com/dp/0986358053/?aod=1,Books › Romance › Contemporary,"finding Reese.: a SAFELIGHT novel vol.2 (the SAFELIGHT series): Santiago, Imy: 9780986358050: Amazon.com: Books",
1626191328,https://www.amazon.com/dp/1626191328/?aod=1,Books › History › Americas,"Witches of Pennsylvania: Occult History & Lore: White, Thomas: 9781626191327: Amazon.com: Books",No button (0)
B016QE4BPI,https://www.amazon.com/dp/B016QE4BPI/?aod=1,CDs & Vinyl › Rap & Hip-Hop › Pop Rap,"KWELI,TALIB - Fuck the Money - Amazon.com Music",No button (0)
B00D3I08NA,https://www.amazon.com/dp/B00D3I08NA/?aod=1,,Amazon.com: Esi Drimo Mixtures Herbs 100g : Health & Household,error
1631523538,https://www.amazon.com/dp/1631523538/?aod=1,Books › Literature & Fiction › Genre Fiction,"The Silver Shoes: A Novel: Hall, Jill G.: 9781631523533: Amazon.com: Books",Not added (23)
B0012M54WE,https://www.amazon.com/dp/B0012M54WE/?aod=1,,"Amazon.com: Batman - Son of the Demon (DC Comics): Mike W. Barr, Jerry Bingham: Books",Not added (1)
0345493044,https://www.amazon.com/dp/0345493044/?aod=1,,"The Steel Remains (A Land Fit for Heroes): Morgan, Richard K.: 9780345493040: Amazon.com: Books",
099669174X,https://www.amazon.com/dp/099669174X/?aod=1,,"The Day of the Dragonking: Book 1 of the Last American Wizard (1): Irving, Edward B, Joyce, Tom: 9780996691741: Amazon.com: Books",
B093RV52PH,https://www.amazon.com/dp/B093RV52PH/?aod=1,,"13 Magick Seals of Santa Muerte: Bustillo, Arnold: 9798747562288: Amazon.com: Books",
1545430101,https://www.amazon.com/dp/1545430101/?aod=1,Books › Literature & Fiction › Short Stories & Anthologies,"Devolution Z April 2017: The Horror Magazine: Devolution Z, Barton, Chance, Roshak, N. R. M., Hill, Martin Roy, Simon, Marge, Neidecker, K.L., Howels, Ben, Anderson, David, Kovacik, Cindy, Klarenbeek, Christina: 9781545430101: Amazon.com: Books",
1800562470,https://www.amazon.com/dp/1800562470/?aod=1,Books › Computers & Technology › Programming,"Modern API Development with Spring and Spring Boot: Design highly scalable and maintainable APIs with REST, gRPC, GraphQL, and the reactive paradigm: Sharma, Sourabh: 9781800562479: Amazon.com: Books",
4776738007,https://www.amazon.com/dp/4776738007/?aod=1,Books › Foreign Language Books › Japanese,Amazon.com: 快感・ブラザーズ 御曹司はテクニシャン (ミッシィコミックス YLC Collection): 9784776738008: Rinko Ichinoseki: Books,No button (0)
1548571075,https://www.amazon.com/dp/1548571075/?aod=1,Books › Literature & Fiction › Erotica,"Amazon.com: Pokey: Areion Fury MC (Volume 4): 9781548571078: Schmidt, Esther E.: Books",
2246677416,https://www.amazon.com/dp/2246677416/?aod=1,Books › Foreign Language Books › French,"Amazon.com: L'ensauvagement Prix fémina essai 2005: 9782246677413: Delpech, Thérèse: Books",
1497497388,https://www.amazon.com/dp/1497497388/?aod=1,Books › Science Fiction & Fantasy › Science Fiction,"Euphoria Z: Ahearn, Luke: 9781497497382: Amazon.com: Books",
0385686218,https://www.amazon.com/dp/0385686218/?aod=1,Books › Biographies & Memoirs › Arts & Literature,"A Newfoundlander in Canada: Always Going Somewhere, Always Coming Home: Doyle, Alan: 9780385686211: Amazon.com: Books",
1138825530,https://www.amazon.com/dp/1138825530/?aod=1,Books › Politics & Social Sciences › Philosophy,"Cybernetics and the Philosophy of Mind (Routledge Library Editions: Philosophy of Mind): Sayre, Kenneth: 9781138825536: Amazon.com: Books",
2892393388,https://www.amazon.com/dp/2892393388/?aod=1,,"L'Univers décodé ou la théorie de l'unification: Haramein, Nassim: 9782892393385: Amazon.com: Books",
0553380389,https://www.amazon.com/dp/0553380389/?aod=1,Books › Literature & Fiction › Genre Fiction,"The Silent: Dann, Jack: 9780732266417: Amazon.com: Books",Added (4)
1851684638,https://www.amazon.com/dp/1851684638/?aod=1,,"Inside The Gender Jihad: Women's Reform in Islam (Islam in the Twenty-First Century): Wadud, Amina: 9781851684632: Amazon.com: Books",Added (2)
1618686356,https://www.amazon.com/dp/1618686356/?aod=1,,"Exit Zero: Cohen, Neil A.: 9781618686350: Amazon.com: Books",
191148561X,https://www.amazon.com/dp/191148561X/?aod=1,Books › Science Fiction & Fantasy › Fantasy,"Amazon.com: Valen: Guardians of Hades Romance Series: 9781911485612: Heaton, Felicity: Books",Not added (5)
0738748196,https://www.amazon.com/dp/0738748196/?aod=1,,"The Witch's Book of Power: Hunter, Devin: 9780738748191: Amazon.com: Books",
B07NRHKDD8,https://www.amazon.com/dp/B07NRHKDD8/?aod=1,CDs & Vinyl › Rock › Roots Rock,Little Steven - Summer of Sorcery - Amazon.com Music,Not added (10)
207079279X,https://www.amazon.com/dp/207079279X/?aod=1,,"La seule exactitude: Finkielkraut, Alain: 9782070792795: Amazon.com: Books",
B06Y43H19W,https://www.amazon.com/dp/B06Y43H19W/?aod=1,Movies & TV › Featured Categories › Blu-ray,"Amazon.com: John Wick: Chapter 2 [4k Ultra HD + Blu-ray + Digital Download] [2017] [Region Free] : Keanu Reeves, Common, Bridget Moynahan, Ian McShane, John Leguizamo, Lance Reddick, Laurence Fishburne, Ruby Rose, Thomas Sadoski, Riccardo Scamarcio, Peter Stormare, Claudia Gerini: Movies & TV",
B08VYFJS4C,https://www.amazon.com/dp/B08VYFJS4C/?aod=1,,"Amazon.com: Belinda Blinked 1: A modern story of sex, erotica and passion. How the sexiest sales girl in business earns her huge bonus by being the best at removing her high heels.: 9798704684909: Flintstone, Rocky, Wood, Mouldy: Books",No button (0)
1637898819,https://www.amazon.com/dp/1637898819/?aod=1,,"Mirrenwood: A Tale of the Unicorn: Hallman, Andrew: 9781637898819: Amazon.com: Books",
2263150005,https://www.amazon.com/dp/2263150005/?aod=1,Books › Self-Help › Relationships,"Et si vous deveniez l'héroïne de votre vie ?: Lesage, Anne-Sophie, Lesage, Fanny, Bretin, Marie: 9782263150005: Amazon.com: Books",
B008SDBMSU,https://www.amazon.com/dp/B008SDBMSU/?aod=1,,Amazon.com: Bicycle Silver Steampunk Poker Size Standard Index Playing Cards,Not added (1)
1937217108,https://www.amazon.com/dp/1937217108/?aod=1,"Books › Health, Fitness & Dieting › Addiction & Recovery","Wanting to Be Free: A Spiritual Approach to Addiction and Recovery: Duffy, Dr Neroli, Hunter, Jenny: 9781937217105: Amazon.com: Books",Not added (5)
1578605490,https://www.amazon.com/dp/1578605490/?aod=1,Books › History › Americas,"Ghosthunting Oregon (America's Haunted Road Trip): Stewart, Donna: 9781578605491: Amazon.com: Books",
B00HBQWYIW,https://www.amazon.com/dp/B00HBQWYIW/?aod=1,Home & Kitchen › Kitchen & Dining › Kitchen Utensils & Gadgets › Cutting Boards › Cutting Boards,Amazon.com: Caroline's Treasures SS4052LCB USA American Flag with Briard Glass Cutting Board Large Decorative Tempered Glass Kitchen Cutting and Serving Board Large Size Chopping Board : Caroline's Treasures: Everything Else,No button (0)
B07HQ77PCY,https://www.amazon.com/dp/B07HQ77PCY/?aod=1,"Health & Household › Vitamins, Minerals & Supplements › Essential Fatty Acids › Fish Oil","Amazon.com: StBotanica Salmon Fish Oil 1000mg; 300mg Omega-3 with 180mg EPA, 120mg DHA - 60 Enteric Coated Softgels : Health & Household",No button (0)
B07S215ZFY,https://www.amazon.com/dp/B07S215ZFY/?aod=1,Automotive › Motorcycle & Powersports › Accessories › Vehicle Covers,"Amazon.com: Favoto Motorcycle Cover All Season Universal Weather Quality Waterproof Sun Outdoor Protection Durable Night Reflective with Lock-Holes & Storage Bag Fits up to 86.6"" Motorcycles Vehicle Cover : Automotive",This item cannot be shipped to your selected delivery location. Please choose a different delivery location. (1)
B00186J0TC,https://www.amazon.com/dp/B00186J0TC/?aod=1,,"Amazon.com: Corvus 750130 Snatch Pulley with Rope 5M, Multi-Color : Toys & Games",Not added (2)
1777198623,https://www.amazon.com/dp/1777198623/?aod=1,,"The ABC's of Islamism: Everything you wanted to know about radical Islam, but were afraid to ask: Raza, Raheel: 9781777198626: Amazon.com: Books",
B08T8LMQJF,https://www.amazon.com/dp/B08T8LMQJF/?aod=1,CDs & Vinyl › Rock,Amazon.com: The Devil In Me: CDs & Vinyl,Not added (7)
B0020H5QPK,https://www.amazon.com/dp/B0020H5QPK/?aod=1,CDs & Vinyl › Dance & Electronic,ROTFRONT - Emigrantski Raggamuffin - Amazon.com Music,
0515156078,https://www.amazon.com/dp/0515156078/?aod=1,Books › Literature & Fiction › Short Stories & Anthologies,"Jason (Anita Blake, Vampire Hunter): Hamilton, Laurell K.: 9780515156072: Amazon.com: Books",Not added (12)
0671041282,https://www.amazon.com/dp/0671041282/?aod=1,,"Power Money Fame Sex: A User's Guide: Rubin, Gretchen: 9780671041281: Amazon.com: Books",
B00M9GZ5X0,https://www.amazon.com/dp/B00M9GZ5X0/?aod=1,Grocery & Gourmet Food › Breads & Bakery › Cookies,"Amazon.com: Mulino Bianco: ""Molinetti"" Shortbread cookies with flour buckwheat and brown sugar - 28.21 Oz (800g) [ Italian Import ] : Grocery & Gourmet Food",Not added (1)
0451467027,https://www.amazon.com/dp/0451467027/?aod=1,Books › Science Fiction & Fantasy › Fantasy,"Tower of Thorns (Blackthorn & Grim): Marillier, Juliet: 9780451467027: Amazon.com: Books",
0062130439,https://www.amazon.com/dp/0062130439/?aod=1,,"Amazon.com: The Secret Circle: The Hunt (Secret Circle, 5): 9780062130433: Smith, L. J.: Books",
1797202065,https://www.amazon.com/dp/1797202065/?aod=1,,"Amazon.com: Discover Your Dharma: A Vedic Guide to Finding Your Purpose: 9781797202068: Rose Ketabi, Sahara, Chopra, Deepak: Books",
2845808763,https://www.amazon.com/dp/2845808763/?aod=1,,"H2, Tome 2: 9782845808768: Amazon.com: Books",
1951168763,https://www.amazon.com/dp/1951168763/?aod=1,,"Religion of the Fathers: Context for the Book of Abraham: Snuffer, Denver C, Archive, Restoration: 9781951168766: Amazon.com: Books",
2352632471,https://www.amazon.com/dp/2352632471/?aod=1,Books › Foreign Language Books › French,"Amazon.com: LES P'TITS ENGINS: 9782352632474: Mathivet, Éric, Dattola, Chiara: Books",Not added (2)
B000066EX9,https://www.amazon.com/dp/B000066EX9/?aod=1,CDs & Vinyl › Indie & Alternative › Hardcore & Punk › British Punk,Sex Pistols - Sex Pistols - Amazon.com Music,No button (0)
B005FQO500,https://www.amazon.com/dp/B005FQO500/?aod=1,"Arts, Crafts & Sewing › Sewing › Sewing Notions & Supplies › Pins & Pincushions › Pins › Safety Pins","Amazon.com: Prym 1-1/2"", 12 pc Safety Pins, 38mm, Silver : Arts, Crafts & Sewing",
1932219366,https://www.amazon.com/dp/1932219366/?aod=1,Books › Arts & Photography › Performing Arts,"Twelfth Night (Arkangel Shakespeare): Shakespeare, William, Cusack, Niamh, Firth, Jonathan, Root, Amanda: 9781932219364: Amazon.com: Books",Added (1)
173455116X,https://www.amazon.com/dp/173455116X/?aod=1,,"Amazon.com: A Magic Touch: A midlife paranormal mystery (Memory Guild): 9781734551167: Parker, Ward: Books",
B09FCFWPPV,https://www.amazon.com/dp/B09FCFWPPV/?aod=1,,"Last Annihilation : Destins liés: Divers, Ewing, Al: 9791039100694: Amazon.com: Books",
1520845650,https://www.amazon.com/dp/1520845650/?aod=1,Books › Literature & Fiction › Genre Fiction,"Un peu après une heure moins le quart (French Edition): SEILER, Marie, MULLER, Odette, LAFRANCE, Marie-Odile: 9781520845654: Amazon.com: Books",
B00YUZRW8O,https://www.amazon.com/dp/B00YUZRW8O/?aod=1,Grocery,Amazon.com : Schwartz Juniper Berries (28g) - Pack of 6 : Grocery & Gourmet Food,Not added (1)
1940761387,https://www.amazon.com/dp/1940761387/?aod=1,Books › Humor & Entertainment › Humor,"Amazon.com: Condoms and Hot Tubs Don't Mix: An Anthology of Awkward Sexcapades: 9781940761381: Jarvis, Jennie, Salas, Leslie: Books",Not added (7)
1719478236,https://www.amazon.com/dp/1719478236/?aod=1,Books › Romance › Contemporary,"Captivated: Bailey, Tessa, Dangerfield, Eve: 9781719478236: Amazon.com: Books",Added (1)
047055116X,https://www.amazon.com/dp/047055116X/?aod=1,,"Amazon.com: Internet Addiction: A Handbook and Guide to Evaluation and Treatment: 9780470551165: Young, Kimberly S., Nabuco de Abreu, Cristiano: Books",Not added (4)
B077GJRSZC,https://www.amazon.com/dp/B077GJRSZC/?aod=1,Sports & Outdoors › Sports › Leisure Sports & Game Room › Table Tennis › Balls,"Amazon.com : STAG Two Star Plastic Table Tennis Ball, 40mm Pack of 6 (Orange) : Sports & Outdoors",This item cannot be shipped to your selected delivery location. Please choose a different delivery location. (1)
B0098FKHBU,https://www.amazon.com/dp/B0098FKHBU/?aod=1,,"Amazon.com: iPhone 5 5S SE Case, Incipio DualPro Case Shockproof Hard Shell Hybrid Authentic Rugged Cover - Black/Black : Cell Phones & Accessories",error
B07MC49HY4,https://www.amazon.com/dp/B07MC49HY4/?aod=1,,Amazon.com: Peg Perego Booklet 50 Travel System - Includes Booklet 50 Baby Stroller and The Primo Viaggio 4-35 Infant Car Seat - Made in Italy - Mon Amour (Beige & Pink) : Everything Else,
1956917004,https://www.amazon.com/dp/1956917004/?aod=1,,"The Lost Librarian's Grave: Tales of Madness, Horror, and Adventure: Press, Redwood, Ahern, Edward, Auch, Owen, Barrows, Brandon, Bates, Paul L., Chabin, Matthew, Coffelt, Sipora, Ellenberger, Zach, Gachs, J.V., Gardner, Adele: 9781956917000: Amazon.com: Books",
B0056PGWGA,https://www.amazon.com/dp/B0056PGWGA/?aod=1,Baby Products › Baby Care › Bathing,"Amazon.com: Vitabiotics Wellkid Baby and Infant Vitamins, Capsule, (150ml) : Baby",No button (0)
0785197249,https://www.amazon.com/dp/0785197249/?aod=1,Books › Comics & Graphic Novels › Graphic Novels,"STAR WARS LEGENDS EPIC COLLECTION: THE EMPIRE VOL. 2 (Epic Collection: Star Wars): Ross, Dave, Wheatley, Doug, Wilkins, Dave, Stradley, Randy: 9780785197249: Amazon.com: Books",No button (0)
184409104X,https://www.amazon.com/dp/184409104X/?aod=1,"Books › Health, Fitness & Dieting › Alternative Medicine","Discover Atlantis: A Guide to Reclaiming the Wisdom of the Ancients: Cooper, Diana: 9781844091041: Amazon.com: Books",
1438461763,https://www.amazon.com/dp/1438461763/?aod=1,,"The Disappearing L: Erasure of Lesbian Spaces and Culture (SUNY series in Queer Politics and Cultures): Morris, Bonnie J.: 9781438461762: Amazon.com: Books",Not added (3)
0345541324,https://www.amazon.com/dp/0345541324/?aod=1,,"Amazon.com: Star Wars: Lost Tribe of the Sith - The Collected Stories (Star Wars: Lost Tribe of the Sith - Legends): 9780345541321: Miller, John Jackson: Books",
B0854QX2TC,https://www.amazon.com/dp/B0854QX2TC/?aod=1,"Health & Household › Vitamins, Minerals & Supplements › Herbal Supplements › Curcumin","Amazon.com: Solgar Full Spectrum Curcumin Brain Works, 90 Licaps - Support Memory Recall, Focus, Cognitive Function - Antioxidant Support - Curcumin, BacoMind, Choline, Vitamin B12 - Non-GMO, Vegan - 30 Servings : Health & Household",Not added (1)
1456352423,https://www.amazon.com/dp/1456352423/?aod=1,,"David & Suzanne's Big Frickin' Canadian Motorcycle Adventure: Moore, David P.: 9781456352424: Amazon.com: Books",
0981324932,https://www.amazon.com/dp/0981324932/?aod=1,Books › LGBTQ+ Books › Literature & Fiction,"Amazon.com: Do You Know Me?: 9780981324937: Soles, Caro: Books",Not added (2)
1414399561,https://www.amazon.com/dp/1414399561/?aod=1,,"Amazon.com: Shaken (Left Behind: The Kids Collection): 9781414399560: Jenkins, Jerry B., LaHaye, Tim: Books",
1780747586,https://www.amazon.com/dp/1780747586/?aod=1,,"Cyber Sufis: Virtual Expressions of the American Muslim Experience (Islam in the Twenty-First Century): Rozehnal, Robert: 9781780747583: Amazon.com: Books",Added (6)
4576072072,https://www.amazon.com/dp/4576072072/?aod=1,Books › Foreign Language Books › Japanese,Amazon.com: Kiki rara koi no tarotto uranai: 9784576072074: RyuÌ„ji Kagami: Books,Added (1)
0986429600,https://www.amazon.com/dp/0986429600/?aod=1,Books › Literature & Fiction › Genre Fiction,"Amazon.com: The Musician's Secret: 9780986429606: Mathew, Litty: Books",
B09FFVRCQL,https://www.amazon.com/dp/B09FFVRCQL/?aod=1,,"Amazon.com : Filofax Saffiano Organizer, Mini Size, Aquamarine - Cross-Grain, Leather-Look, Five Rings, Week-to-View Calendar Diary, Multilingual, 2022 (C028774-22) : Office Products",This item cannot be shipped to your selected delivery location. Please choose a different delivery location. (1)
B094T5SK9X,https://www.amazon.com/dp/B094T5SK9X/?aod=1,,"Amazon.com: Hello, We Love You! The Big Beat EPs (10-inch Vinyl): CDs & Vinyl",
0983775907,https://www.amazon.com/dp/0983775907/?aod=1,,Misleading (Retribution): Winkk: 9780983775904: Amazon.com: Books,
1890159190,https://www.amazon.com/dp/1890159190/?aod=1,Books › Self-Help › Relationships,The Mistress Manual: The Good Girl's Guide to Female Dominance: Mistress Lorelei: 9781890159191: Amazon.com: Books,
B005HK0PEE,https://www.amazon.com/dp/B005HK0PEE/?aod=1,,"Haromac 07185050 Panel Lifter 30-50 inch Adjustable, Stable Version up to 30 kg with Wooden Handle - - Amazon.com",This item cannot be shipped to your selected delivery location. Please choose a different delivery location. (1)
B07C9K1DJ6,https://www.amazon.com/dp/B07C9K1DJ6/?aod=1,,"Amazon.com: Nature’s Way Sambucus Elderberry Gummies for Kids, Immune Support Gummies*, with Vitamin C and Zinc, Delicious Berry Flavor, 60 Gummies : Health & Household",Not added (2)
2373020203,https://www.amazon.com/dp/2373020203/?aod=1,Books › Teen & Young Adult › Science Fiction & Fantasy,"Amazon.com: DURARARA !! - tome 01 (01): 9782373020205: Ryohgo, Narita, Suzuhito, Yasuda: Books",Added (1)
B07R4YN8CY,https://www.amazon.com/dp/B07R4YN8CY/?aod=1,,"Amazon.com : Bragg Organic Apple Cider Vinegar With the Mother– USDA Certified Organic – Raw, Unfiltered All Natural Ingredients, 16 ounce, 2 Pack : Grocery & Gourmet Food",This item cannot be shipped to your selected delivery location. Please choose a different delivery location. (1)
