dp,url,cat,title,BN_status
B016P9HIIQ,https://www.amazon.com/dp/B016P9HIIQ/?aod=1,Beauty & Personal Care › Personal Care › Bath & Bathing Accessories › Bathing Accessories › Bath & Body Brushes,"Amazon.com : artnaturals Cellulite Massager Brush and Mitt - Natural Solution for Eliminating and Removing Cellulite on Arms, Legs, Thighs & Body - Ergonomic Design for Gentle & Effortless Massaging & Exfoliating : Beauty & Personal Care",This item cannot be shipped to your selected delivery location. Please choose a different delivery location. (1)
0578722992,https://www.amazon.com/dp/0578722992/?aod=1,,"Girl, Wasted: A Personal Story of Addiction, Obsession, and Redemption: Taltos, Brittany: 9780578722993: Amazon.com: Books",Added (1)
037327856X,https://www.amazon.com/dp/037327856X/?aod=1,Books › Literature & Fiction › United States,"Secret Agent Secretary (ICE: Black Ops Defenders, 2): Cutler, Melissa: 9780373278565: Amazon.com: Books",Not added (1)
B07Y5R5WTL,https://www.amazon.com/dp/B07Y5R5WTL/?aod=1,Cell Phones & Accessories › Cell Phones,Amazon.com: Tracfone Blu View 1 4G LTE Prepaid Smartphone (Locked) - Black - 16GB - Sim Card Included - CDMA : Cell Phones & Accessories,No button (0)
2344013636,https://www.amazon.com/dp/2344013636/?aod=1,,"Amazon.com: Irena - Tome 01: Le Ghetto: 9782344013632: Evrard, David, Morvan, Jean-David, Tréfouël, Séverine, Pezzali, Walter: Books",
B07L14D7F7,https://www.amazon.com/dp/B07L14D7F7/?aod=1,,"Amazon.com: Huawei Honor 8X (64GB + 4GB RAM) 6.5"" HD 4G LTE GSM Factory Unlocked Smartphone - International Version No Warranty JSN-L23 (Black) : Cell Phones & Accessories",No button (0)
B0849V7R4M,https://www.amazon.com/dp/B0849V7R4M/?aod=1,Electronics › Camera & Photo › Lighting & Studio › Lighting › On-Camera Video Lights,"Amazon.com : JOBY Beamo LED Light for Smartphone and Mirrorless Camera - Compact, Wireless Charging, Bluetooth, Waterproof, for Vlogging, Photo and Video Content Creation : Electronics",This item cannot be shipped to your selected delivery location. Please choose a different delivery location. (1)
B004FGM5JE,https://www.amazon.com/dp/B004FGM5JE/?aod=1,Video Games › Legacy Systems › PlayStation Systems › PlayStation 3 › Games,Amazon.com: Red Dead Redemption: Undead Nightmare [Japan Import] : Video Games,Not added (1)
857827069X,https://www.amazon.com/dp/857827069X/?aod=1,Office Products,Amazon.com: As Cronicas de Narnia - Volume Unico (Em Portugues do Brasil) : _: Everything Else,
1456423932,https://www.amazon.com/dp/1456423932/?aod=1,Books › Science Fiction & Fantasy › Science Fiction,"1666: Williams, Graham Michael: 9781456423933: Amazon.com: Books",
0712656642,https://www.amazon.com/dp/0712656642/?aod=1,Books › Religion & Spirituality › Religious Studies,"PURSUIT OF THE MILLENNIUM, THE: Cohn, Norman: 9780712656641: Amazon.com: Books",
B01LRPBFCS,https://www.amazon.com/dp/B01LRPBFCS/?aod=1,Toys & Games › Remote & App Controlled Vehicles & Parts › Remote & App Controlled Vehicles,"Amazon.com: DJI CP.PT.000343 Phantom Expandable Battery Charging Hub, White : Toys & Games",
B07G9BJ391,https://www.amazon.com/dp/B07G9BJ391/?aod=1,,"Amazon.com: Wireless Earbuds,Bluetooth 5.3 Headphones Noise Cancelling Air Buds Pods 3D Stereo Ear pods in-Ear Ear Bud Built-in Mic IPX7 Waterproof Earphones Sport Headsets for iPhone/Samsung/Android : Electronics",This item cannot be shipped to your selected delivery location. Please choose a different delivery location. (1)
B010E37Y2Y,https://www.amazon.com/dp/B010E37Y2Y/?aod=1,Beauty & Personal Care › Hair Care › Hair Loss Products › Hair Regrowth Treatments,Amazon.com: Priorin Caps 60's : Beauty & Personal Care,This item cannot be shipped to your selected delivery location. Please choose a different delivery location. (1)
B008ML8D4O,https://www.amazon.com/dp/B008ML8D4O/?aod=1,"Health & Household › Vitamins, Minerals & Supplements › Amino Acids › Acetyl-L-Carnitine","Amazon.com: Life Extension N-Acetyl-L-Cysteine (NAC), immune, respiratory, liver health, NAC 600 mg, potent antioxidant support, free-radicals, easy to absorb, 60 capsules : Health & Household",Not added (3)
1925017893,https://www.amazon.com/dp/1925017893/?aod=1,,"Saltwater Reading Cards: Journey with the Messengers of the Sea (36 Full-Color Cards and 96-Page Booklet) (Reading Card Series): Bowen, Laura: 9781925017892: Amazon.com: Books",
1583944559,https://www.amazon.com/dp/1583944559/?aod=1,,"All the World an Icon: Henry Corbin and the Angelic Function of Beings: Cheetham, Tom: 9781583944554: Amazon.com: Books",
0764357743,https://www.amazon.com/dp/0764357743/?aod=1,,"Amazon.com: Dancing Past the Graveyard: Poltergeists, Parasites, Parallel Worlds, and God: 9780764357749: Eno, Paul: Books",
1936451050,https://www.amazon.com/dp/1936451050/?aod=1,Books › Christian Books & Bibles › Ministry & Evangelism,"The Christian Codependence Recovery Workbook: From Surviving to Significance Revised and Updated: Tucker, Stephanie: 9781936451050: Amazon.com: Books",Not added (4)
8439736711,https://www.amazon.com/dp/8439736711/?aod=1,Books › Travel › Europe,"Mona (Spanish Edition): Oloixarac, Pola: 9788439736714: Amazon.com: Books",Not added (30)
B07T76GL28,https://www.amazon.com/dp/B07T76GL28/?aod=1,"Electronics › Computers & Accessories › Laptop Accessories › Bags, Cases & Sleeves › Backpacks",Amazon.com: Harry Potter Backpack Hedwig Owl Hogwarts Letter Laptop Rucksack : Electronics,No button (0)
B07YSNRCDM,https://www.amazon.com/dp/B07YSNRCDM/?aod=1,Health & Household › Wellness & Relaxation › Massage Tools & Equipment,Amazon.com: Sandha Herbal Oil | Stronger Erection | Penis Massage Herbal Oil | Stronger and Longer Sexual Pleasure | Make Your Partner Happy Tonight | 15ml (1) : Health & Household,error
1912383934,https://www.amazon.com/dp/1912383934/?aod=1,,"The Caravanserai Stories: Shah, Tahir: 9781912383931: Amazon.com: Books",
0738746975,https://www.amazon.com/dp/0738746975/?aod=1,Books › Religion & Spirituality › New Age & Spirituality,"Happy Tarot: Ficca, Serena: 9780738746975: Amazon.com: Books",Not added (24)
B00X0W9Y6Q,https://www.amazon.com/dp/B00X0W9Y6Q/?aod=1,"Clothing, Shoes & Jewelry › Men › Accessories › Wallets, Card Cases & Money Organizers › Wallets","Amazon.com: Tommy Hilfiger Men's Wallets, Black-Schwarz (Black 002), Dimensions (W x H x D): 13 x 10 x 2 cm : Clothing, Shoes & Jewelry",This item cannot be shipped to your selected delivery location. Please choose a different delivery location. (1)
B00H8RT0YA,https://www.amazon.com/dp/B00H8RT0YA/?aod=1,"Health & Household › Vitamins, Minerals & Supplements › Vitamins › Vitamin A",Amazon.com: Vitamin A Acetate (Retinol) 25g : Health & Household,Not added (1)
0300238673,https://www.amazon.com/dp/0300238673/?aod=1,,"The Witch: A History of Fear, from Ancient Times to the Present: Hutton, Ronald: 9780300238679: Amazon.com: Books",
1949694151,https://www.amazon.com/dp/1949694151/?aod=1,Books › Teen & Young Adult › Science Fiction & Fantasy,"Amazon.com: Sovereign Sacrifice (4) (Vortex Chronicles): 9781949694154: Kova, Elise: Books",
B006QQQTHU,https://www.amazon.com/dp/B006QQQTHU/?aod=1,,Amazon.com: Revital - 60 Capsules : Health & Household,Not added (4)
0299314901,https://www.amazon.com/dp/0299314901/?aod=1,,"The Mitki and the Art of Postmodern Protest in Russia: Mihailovic, Alexandar: 9780299314903: Amazon.com: Books",Not added (1)
B07RWHMW79,https://www.amazon.com/dp/B07RWHMW79/?aod=1,,Amazon.com : Zonon 4 Pairs Bike Brake Pads Compatible with TRP Tektro Shimano Deore Br-M575 M525 M515 T615 T675 M505 M495 M486 M485 M475 M465 M447 M446 M416 M415 M395 M375 M315 M355 C501s : Sports & Outdoors,No button (0)
B08G8MXKND,https://www.amazon.com/dp/B08G8MXKND/?aod=1,"Cell Phones & Accessories › Cases, Holsters & Sleeves › Flip Cases","Amazon.com: Oppo R7S Case, Wood Grain Leather Case with Card Holder and Window, Magnetic Flip Cover for Oppo R7S : Cell Phones & Accessories",Not added (1)
B00E60WVWU,https://www.amazon.com/dp/B00E60WVWU/?aod=1,,Amazon.com: Clean and Dry - Wash,Not added (2)
0595488501,https://www.amazon.com/dp/0595488501/?aod=1,"Books › Mystery, Thriller & Suspense › Mystery","THE UNRAVELING: Schultz, George: 9780595488506: Amazon.com: Books",Not added (4)
055322834X,https://www.amazon.com/dp/055322834X/?aod=1,Books › Children's Books,Devil Wind (Dark Forces): Laurie Bridges and Paul Alexander: 9780553228342: Amazon.com: Books,
1720605831,https://www.amazon.com/dp/1720605831/?aod=1,Books › Romance › Contemporary,"Respect (The Breaking Point): Crownover, Jay: 9781720605836: Amazon.com: Books",Added (1)
0263914070,https://www.amazon.com/dp/0263914070/?aod=1,Books,Werewolf's Embrace (Mills & Boon Nocturne): 9780263914078: Amazon.com: Books,
1646900006,https://www.amazon.com/dp/1646900006/?aod=1,,"Amazon.com: Odin's Child (1) (The Raven Rings): 9781646900008: Pettersen, Siri, Mackie, Siân, Garrett, Paul Russell: Books",
0062508598,https://www.amazon.com/dp/0062508598/?aod=1,Books › Reference › Encyclopedias & Subject Guides,"Jambalaya: The Natural Woman's Book of Personal Charms and Practical Rituals: Teish, Luisah: 9780062508591: Amazon.com: Books",
B08T2Z4V3L,https://www.amazon.com/dp/B08T2Z4V3L/?aod=1,,"Amazon.com : lionto Tree Scratching Post Tree for Climbing Board Scratching Post Mat, Light Grey : Pet Supplies",
B01LN83F6S,https://www.amazon.com/dp/B01LN83F6S/?aod=1,,Amazon.com : Viaggio Flex 120 - Booster Car Seat - for Children from 40 to 120 lbs - Made in Italy - Crystal Black (Black) : Baby,
0553276867,https://www.amazon.com/dp/0553276867/?aod=1,Books › Literature & Fiction › Action & Adventure,"Amazon.com: Sackett's Land: A Novel: 9780553276862: L'Amour, Louis: Books",
B07HJVHKVY,https://www.amazon.com/dp/B07HJVHKVY/?aod=1,Grocery & Gourmet Food › Beverages › Coffee › Whole Coffee Beans › Roasted Coffee Beans,"Amazon.com : Lavazza Organic Tierra! Whole Bean Coffee Blend,Light Roast,Premium Arabica,USDA Organic,Canada Organic,UTZ & Euro Leaf Organic certified;100% sustainably grown,2.2 Pound (Pack of 1)-package May Vary : Grocery & Gourmet Food",Not added (1)
1439789606,https://www.amazon.com/dp/1439789606/?aod=1,,Amazon.com : Paperblanks 18 Month Planners 2022-2023 Azur | Landscape | Midi (130 × 180 mm) : Office Products,This item cannot be shipped to your selected delivery location. Please choose a different delivery location. (1)
1430215755,https://www.amazon.com/dp/1430215755/?aod=1,Books › Computers & Technology › Networking & Cloud Computing,"Amazon.com: Linux Recipes for Oracle DBAs (Expert's Voice in Oracle): 9781430215752: Kuhn, Darl, Lopuz, Bernard, Kim, Charles: Books",
B0050ZD08O,https://www.amazon.com/dp/B0050ZD08O/?aod=1,,"Amazon.com: Solgar Ubiquinol 200 mg (Reduced CoQ-10), 30 Softgels - Promotes Heart & Brain Function - Supports Healthy Aging - Coenzyme Q10 - Ubiquinone Supplement - Gluten Free, Dairy Free - 30 Servings : Health & Household",Not added (1)
B08149JHFS,https://www.amazon.com/dp/B08149JHFS/?aod=1,"Clothing, Shoes & Jewelry › Luggage & Travel Gear › Luggage › Carry-Ons","Amazon.com | JASLEN Adults, Unisex's Elegant, Pink-Silver, Juego de 3 maletas | Carry-Ons",This item cannot be shipped to your selected delivery location. Please choose a different delivery location. (1)
080413717X,https://www.amazon.com/dp/080413717X/?aod=1,"Books › Mystery, Thriller & Suspense › Thrillers & Suspense","City of Stairs: A Novel (The Divine Cities): Bennett, Robert Jackson: 8601420422032: Amazon.com: Books",
0062049747,https://www.amazon.com/dp/0062049747/?aod=1,,"Does Jesus Really Love Me?: A Gay Christian's Pilgrimage in Search of God in America: Chu, Jeff: 9780062049742: Amazon.com: Books",
1735090409,https://www.amazon.com/dp/1735090409/?aod=1,Books › Medical Books › Medicine,"Kegels Are Not Going to Fix This: The latest medical understanding of pelvic floor disorders and their impact on quality of life: Sack, Georgeann: 9781735090405: Amazon.com: Books",Not added (9)
0226535126,https://www.amazon.com/dp/0226535126/?aod=1,Books › Religion & Spirituality › Religious Studies,"God, Sex, and Politics: Homosexuality and Everyday Theologies: Moon, Dawne: 9780226535128: Amazon.com: Books",
B000IB0EQ6,https://www.amazon.com/dp/B000IB0EQ6/?aod=1,CDs & Vinyl › Indie & Alternative › Alternative Rock › American Alternative,The Goo Goo Dolls - Let Love in - Amazon.com Music,Not added (5)
B0766DZ24P,https://www.amazon.com/dp/B0766DZ24P/?aod=1,CDs & Vinyl › Reggae,MADNESS - Full House: Very Best Of Madness - Amazon.com Music,
1302921827,https://www.amazon.com/dp/1302921827/?aod=1,,Amazon.com: WOLVERINE BY BENJAMIN PERCY VOL. 1: 9781302921828: Marvel Various: Books,
0764341227,https://www.amazon.com/dp/0764341227/?aod=1,Books › History › Americas,"New England’s Scariest Stories and Urban Legends: Paradis, Summer, McManus, Cathy, Ridsdel, Wayne Bud: 9780764341229: Amazon.com: Books",
1641120290,https://www.amazon.com/dp/1641120290/?aod=1,,"Dr. NO: The Discovery That Led to a Nobel Prize and Viagra: Ignarro PhD, Louis: 9781641120296: Amazon.com: Books",
B08D91CPSJ,https://www.amazon.com/dp/B08D91CPSJ/?aod=1,,"Billionaire Unexpected~Jax: The Billionaire's Obsession Series: Scott, J. S.: 9798662617865: Amazon.com: Books",
0823228339,https://www.amazon.com/dp/0823228339/?aod=1,Books › Biographies & Memoirs › Arts & Literature,"A Scholar's Tale: Intellectual Journey of a Displaced Child of Europe: Hartman, Geoffrey: 9780823228331: Amazon.com: Books",
B08KRVMS2J,https://www.amazon.com/dp/B08KRVMS2J/?aod=1,,"Amazon.com: Infant Liquid Ionic Zinc with Organic Glycerin by MaryRuth's, Zinc Sulfate for Immune Support, Vegan, Formulated for Ages 0-12 Months, 1 Month Supply, 2 Fl Oz : Health & Household",No button (0)
1726493482,https://www.amazon.com/dp/1726493482/?aod=1,Books › Literature & Fiction › Literary,"FLAPPERHOUSE #19 - Fall 2018: O'Brien, Joseph P., Ayinla, Wale, Bailey, Khaholi, Claes, Harley, Cook, Juliet, David, J., Frelinghuysen, C. D., hastain, j j, Iwai, Satoshi, Jarrott, Denise: 9781726493482: Amazon.com: Books",
2070360636,https://www.amazon.com/dp/2070360636/?aod=1,Books › Literature & Fiction › Genre Fiction,"Fondation Foudroyee (Folio Science Fiction) (English and French Edition): Asimov, Isaac, Bonnefoy, Jean: 9782070360635: Amazon.com: Books",Added (4)
1548178527,https://www.amazon.com/dp/1548178527/?aod=1,Books › Science Fiction & Fantasy › Fantasy,"Unholy Pleasures (Half-breed Series): Dunbar, Debra: 9781548178529: Amazon.com: Books",
B07ZQ8JCN3,https://www.amazon.com/dp/B07ZQ8JCN3/?aod=1,,Amazon.com: Trojan G. Spot Premium Lubricated Condoms - 10 count : Health & Household,No button (0)
B08CMZHQXG,https://www.amazon.com/dp/B08CMZHQXG/?aod=1,,"Amazon.com: atFoliX Screen Protection Film Compatible with Samsung N5375 32 Inch Screen Protector, Ultra-Clear FX Protective Film : Cell Phones & Accessories",Not added (1)
B001PYD0KW,https://www.amazon.com/dp/B001PYD0KW/?aod=1,,"Amazon.com: In the Realm of the Senses (The Criterion Collection) [Blu-ray] : Tatsuya Fuji, Akiko Koyama, Eiko Matsuda, Aoi Nakajima, Meika Seri, Taiji Tonoyama, Naomi Shiraishi: Movies & TV",Not added (4)
1302905597,https://www.amazon.com/dp/1302905597/?aod=1,Books › Comics & Graphic Novels › Graphic Novels,"Amazon.com: THANOS WINS BY DONNY CATES: 9781302905590: Cates, Donny, Gillen, Kieron, Ewing, Al, Shaw, Geoff, Shaw, Geoff: Books",
B09N9Z3ZYR,https://www.amazon.com/dp/B09N9Z3ZYR/?aod=1,,Amazon.com: Samsung Official S22+ Leather Cover Black : Cell Phones & Accessories,Not added (1)
0743457021,https://www.amazon.com/dp/0743457021/?aod=1,Books › Literature & Fiction › Short Stories & Anthologies,Amazon.com: Gettin' Buck Wild: Sex Chronicles II: 9780743457026: Zane: Books,No button (0)
B00001SIAH,https://www.amazon.com/dp/B00001SIAH/?aod=1,CDs & Vinyl › Indie & Alternative › Goth & Industrial › Industrial › Alt Industrial,My Life with the Thrill Kill Kult - Dirty Little Secrets: Music To Strip By... - Amazon.com Music,Not added (2)
0990964183,https://www.amazon.com/dp/0990964183/?aod=1,Books › Christian Books & Bibles › Christian Living,"Amazon.com: The Gift of Seeing Angels and Demons: A Handbook for Discerners of Spirits: 9780990964186: Merritt, Susan, Stieglitz, Gil: Books",No button (0)
B07K1QYL5N,https://www.amazon.com/dp/B07K1QYL5N/?aod=1,Toys & Games › Toy Figures & Playsets,Amazon.com: Megahouse Excellent Model RAHDXG.A.NEO Sayla Mass [Resale] About 200mm PVC-Painted PVC Figure : Toys & Games,No button (0)
B084HNCGHC,https://www.amazon.com/dp/B084HNCGHC/?aod=1,Toys & Games › Toy Figures & Playsets › Action Figures,Amazon.com: Megahouse G.E.M. Series Palm Size Zenitsu : Toys & Games,
B01E44P7F0,https://www.amazon.com/dp/B01E44P7F0/?aod=1,Automotive › Tools & Equipment › Tire & Wheel Tools › Tire Repair Tools,Amazon.com: XL Perform Tool 552005 Telescopic Compact Wheel Wrench 17 & 19 mm : Automotive,This item cannot be shipped to your selected delivery location. Please choose a different delivery location. (1)
1597804215,https://www.amazon.com/dp/1597804215/?aod=1,Books › Literature & Fiction › Action & Adventure,"Amazon.com: Prepare to Die!: 9781597804219: Tobin, Paul: Books",Added (3)
1500673579,https://www.amazon.com/dp/1500673579/?aod=1,Books › Literature & Fiction › Short Stories & Anthologies,"A Seeming Glass: A Collection of Reflected Tales: Writers, The Random, Jack, Gail, Hetzel, Katherine, Ironside, J. A., Willis, Matthew, Wilson, L., Bromley, Shell, Mark, Stephen, Gilbert, Martin J., Ginnane, Karen: 9781500673574: Amazon.com: Books",
B00NTXLIE2,https://www.amazon.com/dp/B00NTXLIE2/?aod=1,Movies & TV › Featured Categories › Blu-ray,Amazon.com: El verdugo : Movies & TV,Not added (2)
1546692584,https://www.amazon.com/dp/1546692584/?aod=1,Books › Romance › New Adult & College,"Redefining Us: A Reclusive Novel: Rae, Harloe: 9781546692584: Amazon.com: Books",
1922200786,https://www.amazon.com/dp/1922200786/?aod=1,Books › Teen & Young Adult › Science Fiction & Fantasy,"Amazon.com: Cassandra: 9781922200785: Gossow, Kathryn: Books",
0375726837,https://www.amazon.com/dp/0375726837/?aod=1,,"Amazon.com: Experience: A Memoir: 9780375726835: Amis, Martin: Books",
0857058673,https://www.amazon.com/dp/0857058673/?aod=1,Books,"Sanctuary EXPORT: D'Andrea, Luca: 9780857058676: Amazon.com: Books",No button (0)
0143425889,https://www.amazon.com/dp/0143425889/?aod=1,Books › Politics & Social Sciences › Philosophy,"Ramcharitmanas 2: Tulsidas, A.: 9780143425885: Amazon.com: Books",
059340291X,https://www.amazon.com/dp/059340291X/?aod=1,,"Amazon.com: She Persisted: Malala Yousafzai: 9780593402917: Saeed, Aisha, Clinton, Chelsea, Boiger, Alexandra, Flint, Gillian: Books",Not added (29)
0571259545,https://www.amazon.com/dp/0571259545/?aod=1,Books › History › Europe,"If Walls Could Talk: Worsley, Lucy: 8601300338293: Amazon.com: Books",Not added (2)
1925212416,https://www.amazon.com/dp/1925212416/?aod=1,Books › Literature & Fiction › Genre Fiction,"Crow Shine: Baxter, Alan, Anderton, Joanne: 9781925212419: Amazon.com: Books",
4799206214,https://www.amazon.com/dp/4799206214/?aod=1,Books › Foreign Language Books › Japanese,Amazon.com: キミイロデイズ~おんなのこのカラダになったらナニをする?~ (アンリアルコミックス): 9784799206218: Mr. Taniguchi: Books,No button (0)
B00J8QZHF0,https://www.amazon.com/dp/B00J8QZHF0/?aod=1,,CHIODOS - Devil - Amazon.com Music,Not added (2)
0962796654,https://www.amazon.com/dp/0962796654/?aod=1,"Books › Health, Fitness & Dieting › Addiction & Recovery",Sexual Compulsivews Anonymous: A Program of Recovery: Sexual Compulsives Anonymous: 9780962796654: Amazon.com: Books,Not added (1)
1928025919,https://www.amazon.com/dp/1928025919/?aod=1,,"Fire: Demons, Dragons, & Djinns: Parrish, Rhonda: 9781928025917: Amazon.com: Books",Not added (2)
B001TNPZNY,https://www.amazon.com/dp/B001TNPZNY/?aod=1,Pet Supplies › Cats › Litter & Housebreaking › Litter,"Amazon.com : Kerbl Cat Litter with Rim, 51 x 35 x 13 cm, Assorted Colours : Pet Supplies",This item cannot be shipped to your selected delivery location. Please choose a different delivery location. (1)
0670095826,https://www.amazon.com/dp/0670095826/?aod=1,,"Anthology of Humorous Sanskrit Verses: Haksar, A: 9780670095827: Amazon.com: Books",No button (0)
1948427680,https://www.amazon.com/dp/1948427680/?aod=1,,"Avoiding Commitment: Linde, K.A.: 9781948427685: Amazon.com: Books",Not added (5)
1735217131,https://www.amazon.com/dp/1735217131/?aod=1,Books › Literature & Fiction › Short Stories & Anthologies,"Mirrormaze: A Dreampunk Anthology: Jones Jr., Cliff: 9781735217130: Amazon.com: Books",
B085K4BR9Z,https://www.amazon.com/dp/B085K4BR9Z/?aod=1,Toys & Games › Building Toys › Building Sets,"Amazon.com: LEGO DOTS Extra DOTS - Series 2 41916 DIY Craft, A Fun Add-on Tile Set for Kids who Like Arts and Crafts and Decorating Jewelry or Room Décor and Printed Tiles (109 Pieces) : Toys & Games",
0447727613,https://www.amazon.com/dp/0447727613/?aod=1,,The Reign of Wizardry: Jack Williamson: 9780447727616: Amazon.com: Books,Added (6)
1906954518,https://www.amazon.com/dp/1906954518/?aod=1,Books › Self-Help › Motivational,"Selfmade: Finding the Goodness and Greatness Within Yourself: Foster, Carl: 9781906954512: Amazon.com: Books",Added (1)
1913289648,https://www.amazon.com/dp/1913289648/?aod=1,Books › Literature & Fiction › History & Criticism,"Amazon.com: The Inner Sanctums of My Imagination: Crazy Bloody Yanks - The Journey Begins: 9781913289645: Sherriff, R L: Books",
B00FHVZRT6,https://www.amazon.com/dp/B00FHVZRT6/?aod=1,Books › Literature & Fiction › Action & Adventure,"JUDE - Book 1: Transit Hall 37 North 6: Callcut, Eric: 9791091859035: Amazon.com: Books",
1607065169,https://www.amazon.com/dp/1607065169/?aod=1,,Amazon.com: '68 Volume 1: Better Run Through the Jungle: 9781607065166: Mark Kidwell: Books,
1423157516,https://www.amazon.com/dp/1423157516/?aod=1,Books › Children's Books › Science Fiction & Fantasy,"Darkest Minds, The: Never Fade... by Bracken, Alexandra",
1548516473,https://www.amazon.com/dp/1548516473/?aod=1,,"The Liberation of Paul: Donahue, Jim: 9781548516475: Amazon.com: Books",
1999644204,https://www.amazon.com/dp/1999644204/?aod=1,,"We Are Terror: Damas, Hugo, Pezzillo, Gaetano: 9781999644208: Amazon.com: Books",
B086JL48P1,https://www.amazon.com/dp/B086JL48P1/?aod=1,Tools & Home Improvement › Safety & Security › Personal Protective Equipment › Protective Workwear › Safety Apparel › Coveralls,"Disposable Protective Coverall Suit, Full Body Protective from Hazmat and Contamination, Non-Woven Clothing, Dustproof Purification Fabric Isolated Clothing Hood Coverall Suit (XL/175CM) - - Amazon.com",No button (0)
B01AJR81Y0,https://www.amazon.com/dp/B01AJR81Y0/?aod=1,"Health & Household › Vitamins, Minerals & Supplements › Vitamins › Vitamin B › B12","Amazon.com: Jamieson Vitamin B12 Energy Spray- Natural Raspberry Flavour, 58ml : Health & Household",No button (0)
1537466798,https://www.amazon.com/dp/1537466798/?aod=1,Books › Literature & Fiction › United States,"Amazon.com: The Heart Don't Lie: Jewels' Dilemma: 9781537466798: Lasha, Yasheca: Books",
4873061865,https://www.amazon.com/dp/4873061865/?aod=1,Books › Foreign Language Books › Japanese,Amazon.com: 学艶カオス (エンジェルコミックス): 9784873061863: unknown author: Books,No button (0)
B00775N5Z8,https://www.amazon.com/dp/B00775N5Z8/?aod=1,Electronics › Camera & Photo › Tripods & Monopods › Tripod Heads,Amazon.com : Rollei C5i - Aluminum Tripod with Panoramic Ball Head - Arca Swiss Compatible - Max. Load 8 kg - Titanium : Electronics,No button (0)
B01A1DL4DW,https://www.amazon.com/dp/B01A1DL4DW/?aod=1,"Health & Household › Vitamins, Minerals & Supplements › Amino Acids › 5-HTP","Amazon.com: Nutricost 5-HTP 100mg, 240 Vegetarian Capsules (5-Hydroxytryptophan) - Non-GMO & Gluten Free : Health & Household",Not added (1)
1949116484,https://www.amazon.com/dp/1949116484/?aod=1,Books › Literature & Fiction › Genre Fiction,"Till We Become Monsters: Headlee, Amanda: 9781949116489: Amazon.com: Books",
1846072646,https://www.amazon.com/dp/1846072646/?aod=1,Books,In the Danger Zone: Stefan Gates: 9781846072642: Amazon.com: Books,Not added (9)
B00TYLAEWU,https://www.amazon.com/dp/B00TYLAEWU/?aod=1,,Amazon.com : Fehn 071535 pram Chain Sleeping Forest : Toys & Games,
1941147704,https://www.amazon.com/dp/1941147704/?aod=1,,"Burnt Offerings (Valancourt 20th Century Classics): Marasco, Robert, Jones, Stephen Graham: 9781941147702: Amazon.com: Books",
150406030X,https://www.amazon.com/dp/150406030X/?aod=1,Books › Literature & Fiction › Action & Adventure,"Amazon.com: Skeleton Key (The Xanth Novels): 9781504060301: Anthony, Piers: Books",
1974547523,https://www.amazon.com/dp/1974547523/?aod=1,,"The Kidnapped Prince (Ononokin: The Whizzfiddle & Gungren Adventures): Logsdon, John P., Young, Christopher P.: 9781974547524: Amazon.com: Books",
B07ZPLQ87L,https://www.amazon.com/dp/B07ZPLQ87L/?aod=1,,"Amazon.com: Dickie - Hello Kitty Avión con figuras, apertura de techo, incluye 3 figuras y 20 accesorios (Dickie 253248000) : Everything Else",
0964596008,https://www.amazon.com/dp/0964596008/?aod=1,,"Screw the Roses, Send Me the Thorns: The Romance and Sexual Sorcery of Sadomasochism: Devon, Molly, Miller, Philip: 9780964596009: Amazon.com: Books",Not added (4)
1982269936,https://www.amazon.com/dp/1982269936/?aod=1,,"Chasing Radiance: Memoirs & Musings: Sarzin-Borrillo, Erica: 9781982269937: Amazon.com: Books",
B001TSJQVQ,https://www.amazon.com/dp/B001TSJQVQ/?aod=1,,"Amazon.com: Nature Made Multivitamin For Him 50+, Mens Multivitamins for Daily Nutritional Support, Multivitamin for Men, 90 Tablets, 90 Day Supply : Health & Household",Not added (1)
