dp,url,cat,title,BN_status
B071VT9J98,https://www.amazon.com/dp/B071VT9J98/?aod=1,,"Amazon.com: Nature Made 1200 mg Softgels, Fish Oil Supplements, Omega 3 Fish Oil for Healthy Heart Support, with 230 Softgels, 115 Day Supply : Health & Household",No button (0)
B00P2IGZDQ,https://www.amazon.com/dp/B00P2IGZDQ/?aod=1,,"Amazon.com: Zsport Zbra Silver : Clothing, Shoes & Jewelry",Not added (1)
1925682331,https://www.amazon.com/dp/1925682331/?aod=1,Books › Religion & Spirituality › New Age & Spirituality,"Magickal Herb Oracle: Secret Nature Magick (36 Full-Color Cards and 120-Page Guidebook) (Rockpool Oracle Card Series): Darcey, Cheralyn, Dandy, Deer: 9781925682335: Amazon.com: Books",Not added (12)
1518659535,https://www.amazon.com/dp/1518659535/?aod=1,"Books › Health, Fitness & Dieting › Psychology & Counseling","Decoding Your Kink: Guide to Explore, Share and Enjoy Your Wildest Sexual Desires: Fous MTP, Galen: 9781518659539: Amazon.com: Books",Not added (1)
280941727X,https://www.amazon.com/dp/280941727X/?aod=1,Books › Foreign Language Books › French,"Amazon.com: ""american vampire t.1 ; sang neuf"": 9782809417272: Books",Added (1)
187918172X,https://www.amazon.com/dp/187918172X/?aod=1,Books › Religion & Spirituality › Occult & Paranormal,"From the Ashes of Angels: The Forbidden... by Collins, Andrew",
B013SDMZVM,https://www.amazon.com/dp/B013SDMZVM/?aod=1,,"Amazon.com: Beurer MP62 Professional Nail Drill Kit, Portable Electric File Machine with 10 Attachments & 10 Sanding Bands, Efile Dremel for Acrylic Gel Manicure and Pedicure, LED Light, with Storage Case : Everything Else",No button (0)
1578637228,https://www.amazon.com/dp/1578637228/?aod=1,,"Entering Hekate's Garden: The Magick, Medicine & Mystery of Plant Spirit Witchcraft: Brannen, Cyndi: 9781578637225: Amazon.com: Books",Not added (29)
2205080695,https://www.amazon.com/dp/2205080695/?aod=1,Books › Comics & Graphic Novels › Graphic Novels,"Le Lion de Judah - Tome 2: Desberg Stephen, Labiano Hugues: 9782205080698: Amazon.com: Books",
B00005B95T,https://www.amazon.com/dp/B00005B95T/?aod=1,Movies & TV › Featured Categories › DVD › Comedy,"Amazon.com: Fucking Åmål : Alexandra Dahlström, Rebecka Liljeberg, Erica Carlson, Mathias Rust, Stefan Hörberg, Josefine Nyberg, Ralph Carlsson, Maria Hedborg, Axel Widegren, Jill Ung, Lisa Skagerstam, Lina Svantesson, Ulf Brantås, Lukas Moodysson, Bernhard Winkler, Michal Leszczylowski, Anna Anthony, Lars Jönsson, Peter Aalbæk Jensen, Lukas Moodysson: Movies & TV",Not added (3)
B07NP9WZQF,https://www.amazon.com/dp/B07NP9WZQF/?aod=1,,Amazon.com : Dohe – Box of Pens with Hood – 1 mm – 50 Units – Blue : Office Products,This item cannot be shipped to your selected delivery location. Please choose a different delivery location. (1)
272345438X,https://www.amazon.com/dp/272345438X/?aod=1,Books › Comics & Graphic Novels › Manga,"Amazon.com: Berserk, Vol. 15: 9782723454384: Kentaro Miura, Kentaro Miura: Books",
1540522466,https://www.amazon.com/dp/1540522466/?aod=1,Books › Religion & Spirituality › Occult & Paranormal,"Amazon.com: Ghosts, Demons and Psychic Healing Casebook: True stories of paranormal encounters and investigations: 9781540522467: Fragaria, Decanus: Books",
B00O64D3HI,https://www.amazon.com/dp/B00O64D3HI/?aod=1,CDs & Vinyl › Rock,Amazon.com: From The Vault - L.A. Forum (Live In 1975) [2 CD/DVD Combo]: CDs & Vinyl,
B000YDGMNW,https://www.amazon.com/dp/B000YDGMNW/?aod=1,,Amazon.com: Rabbit Wine Aerator Shower Funnel with Sediment Strainer : Everything Else,No button (0)
1506722237,https://www.amazon.com/dp/1506722237/?aod=1,,"The Witcher Volume 6: Witch's Lament: Sztybor, Bartosz, Del Rey, Vanesa, Bellaire, Jordie: 9781506722238: Amazon.com: Books",
B07NZVM3RN,https://www.amazon.com/dp/B07NZVM3RN/?aod=1,Cell Phones & Accessories › Wireless Trade-In Buy Box Widget › Unlocked Wireless Trade-In,"Amazon.com: Samsung Galaxy S10e 128GB+6GB RAM SM-G970 Dual Sim 5.8"" LTE Factory Unlocked Smartphone (International Model) (Prism Black) : Cell Phones & Accessories",Not added (1)
B094JSXWHZ,https://www.amazon.com/dp/B094JSXWHZ/?aod=1,,JOOLA Table Tennis Bat Carbon X Pro ITTF Approved Professional Competition Ping Pong Racket Black/Grey 2.0 MM Sponge,No button (0)
B01H2T46KQ,https://www.amazon.com/dp/B01H2T46KQ/?aod=1,,Amazon.com: Nemesis Now Aged Pentagram Candlesticks Candle Holder 13.4cm Grey : Home & Kitchen,No button (0)
B07LFJD39S,https://www.amazon.com/dp/B07LFJD39S/?aod=1,Cell Phones & Accessories › Accessories › Automobile Accessories › Cradles,Amazon.com: Vehicle Cell Phone Holder Mount for Car Windshield and Dashboard with Sticky Suction Cup Base Adjustable Cradle and Flexible Gooseneck Design : Cell Phones & Accessories,Not added (1)
1593278020,https://www.amazon.com/dp/1593278020/?aod=1,,"Practical Packet Analysis, 3rd Edition: Using Wireshark to Solve Real-World Network Problems: 9781593278021: Computer Science Books @ Amazon.com",Added (12)
B00FXXPW6G,https://www.amazon.com/dp/B00FXXPW6G/?aod=1,Sports & Outdoors › Hunting & Fishing › Archery › Accessories › Protective Gear › Arm Guards,"Amazon.com: Allen Company Mesh Archery Armguard, Medium, Pink (42017) : Everything Else",
B07KGQDTJN,https://www.amazon.com/dp/B07KGQDTJN/?aod=1,,Amazon.com: Samsung Galaxy Note9 N960U 128GB Unlocked GSM LTE Phone w/ Dual 12MP Camera - Cloud Silver : Cell Phones & Accessories,No button (0)
B00654DUJI,https://www.amazon.com/dp/B00654DUJI/?aod=1,Grocery,Amazon.com : Lindt Advent Calendar - 160G : Holiday Decor Advent Calendars : Grocery & Gourmet Food,No button (0)
2017082155,https://www.amazon.com/dp/2017082155/?aod=1,Books › Children's Books › Growing Up & Facts of Life,"Amazon.com: Les histoires de P'tit Sami Maternelle (3-5 ans) : Sami et Julie à la chasse aux oeufs: 9782017082156: Beaucourt, Cécile: Books",No button (0)
0738757861,https://www.amazon.com/dp/0738757861/?aod=1,,"Amazon.com: Crossroads of Conjure: The Roots and Practices of Granny Magic, Hoodoo, Brujería, and Curanderismo: 9780738757865: Rasbold, Katrina: Books",
1942906455,https://www.amazon.com/dp/1942906455/?aod=1,,"A Scent of Greek (Out of Olympus #2): Folsom, Tina: 9781942906452: Amazon.com: Books",
B000PH2SA8,https://www.amazon.com/dp/B000PH2SA8/?aod=1,"Cell Phones & Accessories › Accessories › Maintenance, Upkeep & Repairs › Screen Protectors","Amazon.com: BoxWave Screen Protector Compatible with Honeywell Dolphin 99GX (Screen Protector by BoxWave) - ClearTouch Anti-Glare, Anti-Fingerprint, Scratch Proof Matte Film Shield : Cell Phones & Accessories",Not added (1)
B07PT3GLST,https://www.amazon.com/dp/B07PT3GLST/?aod=1,,"Amazon.com: Case Logic Reflect 13"" MacBook Pro Sleeve-Dark Blue, Graphite : Electronics",No button (0)
B08KSCC1HC,https://www.amazon.com/dp/B08KSCC1HC/?aod=1,,"Amazon.com: Ringke Fusion-X Designed for Google Pixel 5 Case (2020), Rugged Pixel 5 Clear Cover, Military Grade Protective TPU Bumper Case for Pixel 5 (6.0 Inch) - Black : Cell Phones & Accessories",No button (0)
2213630798,https://www.amazon.com/dp/2213630798/?aod=1,Books › Foreign Language Books › French,"Amazon.com: L'Etat en Afrique: La politique du ventre (French Edition): 9782213630793: Bayart, Jean-François: Books",
B077ZF37J5,https://www.amazon.com/dp/B077ZF37J5/?aod=1,,Amazon.com: QI Receiver for iPhone 5-5c- SE- 6-6 Plus- 7-7 Plus- iPhone Wireless Receiver- QI Receiver- Charging Receiver - QI Wireless Receiver iPhone- QI Wireless Charging Adapter : Cell Phones & Accessories,No button (0)
1519693001,https://www.amazon.com/dp/1519693001/?aod=1,Books › Literature & Fiction › Dramas & Plays,"Love Song in Sixteen Bars: Garrow, Colin: 9781519693006: Amazon.com: Books",
B01EE579X2,https://www.amazon.com/dp/B01EE579X2/?aod=1,Grocery & Gourmet Food › Beverages › Tea › Green › Matcha,Amazon.com: Matcha green Tea instant sticks : Grocery & Gourmet Food,No button (0)
4778314956,https://www.amazon.com/dp/4778314956/?aod=1,Books › Foreign Language Books › Japanese,Amazon.com: 鬱屈精神科医、占いにすがる: 9784778314958: Books,No button (0)
0099288478,https://www.amazon.com/dp/0099288478/?aod=1,,"The Woman in Black: Hill, Susan: 9780099288473: Amazon.com: Books",
B00DE5H95W,https://www.amazon.com/dp/B00DE5H95W/?aod=1,,Amazon.com: Wolfcraft 6095000 Steel Wool 000 Grit 200 g : Industrial & Scientific,This item cannot be shipped to your selected delivery location. Please choose a different delivery location. (1)
1846148804,https://www.amazon.com/dp/1846148804/?aod=1,Books,Cabin Porn: Inspiration for Your Quiet Place Somewhere: Zach Klein: 9781846148804: Amazon.com: Books,Not added (4)
B01MQZYMMS,https://www.amazon.com/dp/B01MQZYMMS/?aod=1,Books › History › Asia,"Amazon.com: Hindu Rulers, Muslim Subjects: Islam, Rights, and the History of Kashmir: 9780691116884: Rai, Mridu: Books",
B004KJET4A,https://www.amazon.com/dp/B004KJET4A/?aod=1,"Musical Instruments › Instrument Accessories › Guitar & Bass Accessories › Amplifier Accessories › Bags, Cases & Covers",Amazon.com: Hardcase HN10S Snare Case 25.4 cm (10 Inches) : Musical Instruments,No button (0)
0007259883,https://www.amazon.com/dp/0007259883/?aod=1,Books › Business & Money › Industries,"Gordon Ramsay's Playing with Fire: Ramsay, Gordon: 9780007259885: Amazon.com: Books",No button (0)
2368527826,https://www.amazon.com/dp/2368527826/?aod=1,Books › Comics & Graphic Novels › Manga,"Amazon.com: Demon Tune - tome 1 (1): 9782368527825: Kodama, Yuki, Daumarie-sauvignon, Xavière: Books",Not added (4)
B078T2T2FL,https://www.amazon.com/dp/B078T2T2FL/?aod=1,,Amazon.com: Huawei Mate 10 Porsche Design Factory Unlocked 256GB Android Smartphone Diamond Black : Cell Phones & Accessories,No button (0)
1501117017,https://www.amazon.com/dp/1501117017/?aod=1,,"The House of the Spirits: A Novel: Allende, Isabel: 9781501117015: Amazon.com: Books",
1613020112,https://www.amazon.com/dp/1613020112/?aod=1,Books › Literature & Fiction › Erotica,"Amazon.com: A Change of Needs: 9781613020111: Allen, Nate: Books",
B079MSX1BK,https://www.amazon.com/dp/B079MSX1BK/?aod=1,,"Amazon.com: Fifty Shades of Grey - Befreite Lust 4K, 2 UHD-Blu-ray : Movies & TV",
1393881254,https://www.amazon.com/dp/1393881254/?aod=1,,"Amazon.com: Fade Away: 9781393881254: Ray, M L: Books",
8478088210,https://www.amazon.com/dp/8478088210/?aod=1,,"Cómo hablar y escuchar a tu ángel de la guarda (Spanish Edition): Kermie Wohlenhaus, Carlos Osses: 9788478088218: Amazon.com: Books",
1496025466,https://www.amazon.com/dp/1496025466/?aod=1,,"Suck Me Dry 3: Pajama Party (Erotic Flash Fiction): Phoenix, Gemini: 9781496025463: Amazon.com: Books",No button (0)
B08L66TXHK,https://www.amazon.com/dp/B08L66TXHK/?aod=1,,"Amazon.com: Sistema KLIP IT PLUS Food Storage Container | 2.2 Litre Leak-Proof, Stackable & Airtight Fridge/Freezer Food Boxes | BPA-Free Plastic | Recyclable with TerraCycle® | 1 Count: Home & Kitchen",No button (0)
B01DJL4CFK,https://www.amazon.com/dp/B01DJL4CFK/?aod=1,,"Amazon.com : The Original Bouncy Bands® for Desks (Black) - Children Love Bouncing Their feet and Feeling The Tension to Relieve Their Anxiety, hyperactivity, Frustration, or Boredom : Office Products",No button (0)
1950565483,https://www.amazon.com/dp/1950565483/?aod=1,Books › Literature & Fiction › Genre Fiction,"A Fresh Start (Crossroad Press Ladies of Horror): Canon, Somer: 9781950565481: Amazon.com: Books",
0615758770,https://www.amazon.com/dp/0615758770/?aod=1,Books › Teen & Young Adult › Literature & Fiction,"Amazon.com: Sexted!: 9780615758770: Coombs, Karen Mueller: Books",
1606130897,https://www.amazon.com/dp/1606130897/?aod=1,"Books › Health, Fitness & Dieting › Sexual Health",The Boys' Guide to Growing Up: Choices and Changes During Puberty: Terri C. Couwenhoven: 9781606130896: Amazon.com: Books,Not added (2)
2745996304,https://www.amazon.com/dp/2745996304/?aod=1,,"Petites comptines sur l'eau: Cosneau, Géraldine: 9782745996305: Amazon.com: Books",Not added (4)
B07XQVHHLR,https://www.amazon.com/dp/B07XQVHHLR/?aod=1,,"Amazon.com: instax Mini Link Smartphone Printer, Ash White : Office Products",
0761189335,https://www.amazon.com/dp/0761189335/?aod=1,Books › Arts & Photography › Performing Arts,"Dancers After Dark: Matter, Jordan: 9780761189336: Amazon.com: Books",No button (0)
4799505874,https://www.amazon.com/dp/4799505874/?aod=1,Books › Foreign Language Books › Japanese,Amazon.com: DVD BugBug DVDRip Game Maniacs (Fujimi Mook) JAPANESE ADULT MAGAZINE: 9784799505878: SCOLA: Books,error
B00A8BEK9S,https://www.amazon.com/dp/B00A8BEK9S/?aod=1,Electronics › Computers & Accessories › Networking Products › Switches,Amazon.com: Cisco Small Business SG300-28 Switch - SRW2024-K9 : Electronics,Not added (2)
4758016550,https://www.amazon.com/dp/4758016550/?aod=1,Books › Foreign Language Books › Japanese,IIZUKA HARUKO ART WORKS HARE HARE (Japanese... by Haruko Iizuka,Not added (3)
B01J1B7IV2,https://www.amazon.com/dp/B01J1B7IV2/?aod=1,"Grocery & Gourmet Food › Pantry Staples › Jams, Jellies & Sweet Spreads › Jams, Jellies & Preserves › Jams & Preserves",Amazon.com: 24oz Tropics Ube Halaya Purple Yam Jam (Pack of 1) : Grocery & Gourmet Food,This item cannot be shipped to your selected delivery location. Please choose a different delivery location. (1)
4062813955,https://www.amazon.com/dp/4062813955/?aod=1,Books › Foreign Language Books › Japanese,Amazon.com: Decipher right out! Palm reading the future to live better (Kodansha plus alpha Novel) (2010) ISBN: 4062813955 [Japanese Import]: 9784062813952: Michi Miyazawa: Books,Added (1)
B08HLF5XS2,https://www.amazon.com/dp/B08HLF5XS2/?aod=1,"Cell Phones & Accessories › Cases, Holsters & Sleeves › Flip Cases","Amazon.com: Infinix Hot 10 Case, Leather Wallet Case with Cash & Card Slots Soft TPU Back Cover Magnet Flip Case for Infinix Hot 10 : Cell Phones & Accessories",Not added (1)
B000GG5IYQ,https://www.amazon.com/dp/B000GG5IYQ/?aod=1,,"Amazon.com : Bigelow Tea Green Tea with Lemon, Caffeinated, 20 Count (Pack of 6), 120 Total Tea Bags : Grocery & Gourmet Food",Not added (1)
B0000C53V4,https://www.amazon.com/dp/B0000C53V4/?aod=1,"Hunting & Fishing › Shooting › Gun Accessories, Maintenance & Storage › Gun & Ammunition Storage & Safes › Ammunition & Magazine Boxes, Cans & Cases","Amazon.com: MTM H50-RM Deluxe 50-Round Rifle Ammo Box 220 Swift 22-250 243 308 Win, Green : Sports & Outdoors",
1948455080,https://www.amazon.com/dp/1948455080/?aod=1,Books › Science Fiction & Fantasy › Fantasy,"Demon Sworn (The Witch's Rebels): Piper, Sarah: 9781948455084: Amazon.com: Books",Not added (6)
B0009WFFTA,https://www.amazon.com/dp/B0009WFFTA/?aod=1,Movies & TV › Featured Categories › DVD › Drama,"Amazon.com: Crazed : Catherine Bach, Leslie Caron, Ramon Bieri, Bruce Graziano, Allen Jaffe: Movies & TV",
1785640127,https://www.amazon.com/dp/1785640127/?aod=1,,"The Summer House: Scott, RJ: 9781785640124: Amazon.com: Books",Not added (1)
9352641752,https://www.amazon.com/dp/9352641752/?aod=1,Books › Biographies & Memoirs › Arts & Literature,"Standing on an Apple Box: The Story of a Girl among the Stars: Rajinikanth Dhanush, Aishwaryaa: 9789352641758: Amazon.com: Books",
1546408762,https://www.amazon.com/dp/1546408762/?aod=1,Books › Self-Help › Abuse,"Abused: Out Of The Darkness: Silba, T J: 9781546408765: Amazon.com: Books",
1328707385,https://www.amazon.com/dp/1328707385/?aod=1,,"The Four Guardians (Pride Wars): Laney, Matt: 9781328707383: Amazon.com: Books",
1302920316,https://www.amazon.com/dp/1302920316/?aod=1,,Amazon.com: LOKI: THE GOLD WHO FELL TO EARTH: 9781302920319: Marvel Various: Books,No button (0)
B000S20HD0,https://www.amazon.com/dp/B000S20HD0/?aod=1,CDs & Vinyl › Rock › Oldies & Retro › Rockabilly,"Presley, Elvis - Elvis - The King - Amazon.com Music",
B003P9BG2E,https://www.amazon.com/dp/B003P9BG2E/?aod=1,"Health & Household › Vitamins, Minerals & Supplements › Essential Fatty Acids › Omega Oils › Omega-3",Amazon.com: TruNature Triple Strength Omega-3 900 mg - 150 Enteric Coated Softgels : Health & Household,No button (0)
2205078038,https://www.amazon.com/dp/2205078038/?aod=1,Books › Comics & Graphic Novels › Graphic Novels,"Barbe-Rouge - Intégrales - Tome 12 - L'Ombre du démon: Perrissin, Bourgne: 9782205078039: Amazon.com: Books",
0692399437,https://www.amazon.com/dp/0692399437/?aod=1,Books › Literature & Fiction › Women's Fiction,"From A to Zoe: A Novel: Fortis, Marie-Jo: 9780692399439: Amazon.com: Books",
B00OZ2MPVG,https://www.amazon.com/dp/B00OZ2MPVG/?aod=1,Video Games › Legacy Systems,"Amazon.com: Dragon Quest Heroes Darkness Dragon and of the World Tree Castle (First Award ""Dragon Quest III Hero Costume"" Code Included) : Video Games",No button (0)
B07C2KKP9F,https://www.amazon.com/dp/B07C2KKP9F/?aod=1,Sports & Outdoors › Outdoor Recreation › Camping & Hiking › Tents & Shelters › Camping Shelters,Amazon.com: Brunner Camping Products Cab II NG : Sports & Outdoors,This item cannot be shipped to your selected delivery location. Please choose a different delivery location. (1)
B07TCB65GK,https://www.amazon.com/dp/B07TCB65GK/?aod=1,,Amazon.com: JEU PC KOCH MEDIA AVENGERS PC : Electronics,This item cannot be shipped to your selected delivery location. Please choose a different delivery location. (1)
B0718W61TV,https://www.amazon.com/dp/B0718W61TV/?aod=1,Toys & Games › Games & Accessories › Game Accessories › Dice & Accessories › Standard Game Dice,"Amazon.com: Bescon Alphabet Dice 20 Faces A-T Uppercase, 20 Sides Letter Dice, 3pcs per Set : Toys & Games",No button (0)
B07K7JWGS7,https://www.amazon.com/dp/B07K7JWGS7/?aod=1,"Health & Household › Vitamins, Minerals & Supplements › Herbal Supplements › Ginkgo Biloba","Amazon.com: Herba Organica Ginkgo Biloba Leaf - Ginkgo Biloba L Ginkgo, Gingko (100g) : Health & Household",Not added (2)
B07T862RHV,https://www.amazon.com/dp/B07T862RHV/?aod=1,Electronics › Computers & Accessories › Computer Accessories & Peripherals › Cables & Accessories › Cables & Interconnects › USB Cables,"Amazon.com: BoxWave Cable Compatible with Garmin Edge 520 Plus (Cable by BoxWave) - Micro USB DuraCable, Braided Micro USB Charging Cable for Garmin Edge 520 Plus - Space Grey : Electronics",Not added (1)
4063643026,https://www.amazon.com/dp/4063643026/?aod=1,Books › Foreign Language Books › Japanese,Amazon.com: Sweet devil laugh (1) (Kodansha Comics good friend) (2011) ISBN: 4063643026 [Japanese Import]: 9784063643022: Books,Added (1)
1789292360,https://www.amazon.com/dp/1789292360/?aod=1,,"Close to Where the Heart Gives Out: A Year in the Life of an Orkney Doctor: Alexander, Dr. Malcolm: 9781789292367: Amazon.com: Books",
B009W3YWWS,https://www.amazon.com/dp/B009W3YWWS/?aod=1,Movies & TV › Featured Categories › DVD,Amazon.com: 歩ふう花 ふる~んポンチ [DVD] : Movies & TV,
1537025325,https://www.amazon.com/dp/1537025325/?aod=1,,"Stalking the Crow (The Tony Crow mystery series) (Volume 3): Schwartz, Howard A: 9781537025322: Amazon.com: Books",
B01HFZVBZU,https://www.amazon.com/dp/B01HFZVBZU/?aod=1,"Cell Phones & Accessories › Accessories › Maintenance, Upkeep & Repairs › Screen Protectors","Amazon.com: atFoliX Screen Protector Compatible with Alcatel One Touch Pixi 4 (4) Screen Protection Film, Anti-Reflective and Shock-Absorbing FX Protector Film (3X) : Cell Phones & Accessories",Not added (1)
B073XWKGQQ,https://www.amazon.com/dp/B073XWKGQQ/?aod=1,,Amazon.com: DJI Original Spark Drone Intelligent Flight Battery 1480 MAh 16Mins Flight Time - CP.PT.000789 : Toys & Games,No button (0)
B07J1N5HBD,https://www.amazon.com/dp/B07J1N5HBD/?aod=1,Toys & Games › Games & Accessories › Card Games › Standard Playing Card Decks,Amazon.com: Bicycle Fireflies Playing Cards : Toys & Games,Not added (2)
B0001IXA4Y,https://www.amazon.com/dp/B0001IXA4Y/?aod=1,,"Amazon.com: La Cafetiere Bialetti Tuttocrema Frothing Jug, Teflon Non Stick Surface and Double Filter For Extra Frothy Milk: Electric Milk Frothers: Home & Kitchen",This item cannot be shipped to your selected delivery location. Please choose a different delivery location. (1)
B0861TV6VX,https://www.amazon.com/dp/B0861TV6VX/?aod=1,,"Amazon.com: OZIVA Plant Based Hair Vitamins | Hair Vitamins for Hair Growth & Better Hair Health (with Omega-3, Biotin & Vitamin E for Hair), Certified Clean & Vegan, 60 Capsules : Beauty & Personal Care",No button (0)
B0000036WX,https://www.amazon.com/dp/B0000036WX/?aod=1,CDs & Vinyl › International Music › Far East & Asia › Japan,Guitar Wolf - Missile Me! - Amazon.com Music,
1953600018,https://www.amazon.com/dp/1953600018/?aod=1,,"Amazon.com: Hunger Pangs: True Love Bites: Fluff and Fangs: 9781953600011: Demorra, Joy, Andrews, Christina Rose, Hickman, Rye: Books",
B003Z7R44A,https://www.amazon.com/dp/B003Z7R44A/?aod=1,Movies & TV › Featured Categories › DVD,Amazon.com: Matrix (1 Disco) (Import Dvd) (1999) Hugo Weawing; Keanu Reeves; Laurence Fish : Movies & TV,
B09W8LBKQF,https://www.amazon.com/dp/B09W8LBKQF/?aod=1,,Amazon.com: Chessex Dice Set – 10mm Scarab Jade/Gold Green Plastic Polyhedral Dice Set – Dungeons and Dragons D&D DND TTRPG Dice – Includes 7 Dice - D4 D6 D8 D10 D12 D20 D% (CHX20415) : Toys & Games,Not added (1)
B07R3GPFH5,https://www.amazon.com/dp/B07R3GPFH5/?aod=1,,"Amazon.com: ChapStick S'mores Collection Graham Cracker, Marshmallow and Milk Chocolate Flavored Lip Balm Tubes Variety Pack, Lip Care - 0.15 Oz (Pack of 3) : Beauty & Personal Care",Not added (2)
B018GUMATO,https://www.amazon.com/dp/B018GUMATO/?aod=1,Electronics › Computers & Accessories › Networking Products › Switches,Amazon.com: Ubiquiti EdgeSwitch 16 - Switch - 16 Ports - Managed - Rack-Mountable - Black (ES-16-150W) : Electronics,This item cannot be shipped to your selected delivery location. Please choose a different delivery location. (1)
0648080129,https://www.amazon.com/dp/0648080129/?aod=1,,"Amazon.com: A Dance of Silver and Shadow: A Retelling of The Twelve Dancing Princesses (Beyond the Four Kingdoms): 9780648080121: Cellier, Melanie: Books",
B000S20HD0,https://www.amazon.com/dp/B000S20HD0/?aod=1,CDs & Vinyl › Rock › Oldies & Retro › Rockabilly,"Presley, Elvis - Elvis - The King - Amazon.com Music",
2344020179,https://www.amazon.com/dp/2344020179/?aod=1,Books › Comics & Graphic Novels › Graphic Novels,"Black Magick - Tome 02: Scott, Nicola, Rucka, Greg, Scott, Nicola: 9782344020173: Amazon.com: Books",
B001D40U5C,https://www.amazon.com/dp/B001D40U5C/?aod=1,Movies & TV › Blu-ray › Movies,Amazon.com: Zombie Strippers [Blu-ray] : Movies & TV,Not added (2)
B071Z6H3VT,https://www.amazon.com/dp/B071Z6H3VT/?aod=1,"Grocery & Gourmet Food › Pantry Staples › Cooking & Baking › Frosting, Icing & Decorations › Edible Printer Ink & Paper",Amazon.com: Sweet Sticks Edible Art Decorative Paint Honey Gold 15ml : Grocery & Gourmet Food,This item cannot be shipped to your selected delivery location. Please choose a different delivery location. (1)
1500848514,https://www.amazon.com/dp/1500848514/?aod=1,,"Amazon.com: Life Is Just Another Class: One Soul's Journey Through Past Life Regression: 9781500848514: Kubicko, Karen Ann: Books",
B00GHU89PA,https://www.amazon.com/dp/B00GHU89PA/?aod=1,Movies & TV › TV,Amazon.com: Yoga Sweat Yoga DVD for Weight Loss with Julie Schoen - Powerful and Fun Yoga : Movies & TV,Not added (1)
077042824X,https://www.amazon.com/dp/077042824X/?aod=1,Books › Literature & Fiction › Contemporary,"Lady Oracle: Atwood, Margaret: 9780770428242: Amazon.com: Books",
1472217721,https://www.amazon.com/dp/1472217721/?aod=1,Books › Literature & Fiction › Short Stories & Anthologies,"Trigger Warning: Short Fictions and Disturbances: Gaiman, N.: 9781472217721: Amazon.com: Books",
B019G9DQOW,https://www.amazon.com/dp/B019G9DQOW/?aod=1,Movies & TV › Featured Categories › Blu-ray,Amazon.com: Masters Of Sex - Temporada 3 : Movies & TV,Not added (1)
162317421X,https://www.amazon.com/dp/162317421X/?aod=1,Books › Religion & Spirituality › New Age & Spirituality,"The Sacred Alignments and Sigils: Angelic Magick, Renaissance Thought, and Modern Methods of Sigilization: Podgurski, Robert, Stein, Charles: 9781623174217: Amazon.com: Books",
B01JPICCR6,https://www.amazon.com/dp/B01JPICCR6/?aod=1,,Amazon.com: Incipio Haven iPhone 8 & iPhone 7 Case with Precision Engineered Suspension Padding Units for iPhone 8 & iPhone 7 - Frost : Cell Phones & Accessories,This item cannot be shipped to your selected delivery location. Please choose a different delivery location. (1)
0738757241,https://www.amazon.com/dp/0738757241/?aod=1,,"Modern Witch: Spells, Recipes & Workings: Hunter, Devin: 9780738757247: Amazon.com: Books",
0981324932,https://www.amazon.com/dp/0981324932/?aod=1,Books › LGBTQ+ Books › Literature & Fiction,"Amazon.com: Do You Know Me?: 9780981324937: Soles, Caro: Books",Not added (2)
B008FVQNSE,https://www.amazon.com/dp/B008FVQNSE/?aod=1,Beauty & Personal Care › Hair Care › Styling Products › Hair Sprays,Amazon.com : Bumble and bumble Surf Spray 1.7 oz (travel size) : Hair Sprays : Beauty & Personal Care,No button (0)
0374175446,https://www.amazon.com/dp/0374175446/?aod=1,Books › Literature & Fiction › Genre Fiction,"Amazon.com: Gutshot: Stories: 9780374175443: Gray, Amelia: Books",Not added (31)
8883955226,https://www.amazon.com/dp/8883955226/?aod=1,Books,TAROCCHI DELLE DEE: Maria Caratti: 9788883955228: Amazon.com: Books,No button (0)
B07P1CCW4C,https://www.amazon.com/dp/B07P1CCW4C/?aod=1,Pet Supplies › Cats › Litter & Housebreaking › Litter,"Amazon.com : Catsan Natural Clumping Cat Litter 20 Litre Bag, 100 Percent Biodegradable, Extra Absorbent : Pet Supplies",No button (0)
