dp,url,cat,title,BN_status
0671041282,https://www.amazon.com/dp/0671041282/?aod=1,,"Power Money Fame Sex: A User's Guide: Rubin, Gretchen: 9780671041281: Amazon.com: Books",
1302920405,https://www.amazon.com/dp/1302920405/?aod=1,Books › Comics & Graphic Novels › Graphic Novels,"Amazon.com: CAPTAIN AMERICA BY TA-NEHISI COATES VOL. 4: ALL DIE YOUNG: 9781302920401: Coates, Ta-Nehisi: Books",No button (0)
0441006779,https://www.amazon.com/dp/0441006779/?aod=1,Books › Literature & Fiction › Action & Adventure,"Amazon.com: Millennium (Ace Science Fiction): 9780441006779: Varley, John: Books",
B001VBK48K,https://www.amazon.com/dp/B001VBK48K/?aod=1,,Amazon.com : walimex FT-8051 260cm Light Stand : Electronics,This item cannot be shipped to your selected delivery location. Please choose a different delivery location. (1)
1076012787,https://www.amazon.com/dp/1076012787/?aod=1,Books › Literature & Fiction › Genre Fiction,"Hard to Find (Hell Hounds Harem): Michaels, Briana: 9781076012784: Amazon.com: Books",
B000PGDY6Q,https://www.amazon.com/dp/B000PGDY6Q/?aod=1,CDs & Vinyl › Pop › Dance Pop,Madonna - Erotica - Amazon.com Music,Not added (2)
B000ROAPTA,https://www.amazon.com/dp/B000ROAPTA/?aod=1,,"Amazon.com: Red Sun : Charles Bronson, Toshiro Mifune, Ursula Andress, Alain Delon, Terence Young: Movies & TV",No button (0)
B009SMYF5M,https://www.amazon.com/dp/B009SMYF5M/?aod=1,,Amazon.com: Trojan Ecstasy Ultra Ribb Size 3ct Trojan Ecstasy Ultra Ribbed 3ct : Health & Household,Not added (1)
2809495289,https://www.amazon.com/dp/2809495289/?aod=1,,"Ghost Rider T02: Aux coeurs des ténèbres (II): Frigeri, Juan, Boschi, Roland, Brisson, Ed: 9782809495287: Amazon.com: Books",
1542092086,https://www.amazon.com/dp/1542092086/?aod=1,Books › Children's Books › Growing Up & Facts of Life,"It's Halloween, Little Monster: Ketteman, Helen, Leick, Bonnie: 9781542092081: Amazon.com: Books",
B07C8PPSVZ,https://www.amazon.com/dp/B07C8PPSVZ/?aod=1,Tools & Home Improvement › Electrical › Wall Plates & Accessories › Wall Plates,"Knightsbridge CU4000 Curved Edge 10 A 3 Gang 2 Way Switch, White - - Amazon.com",This item cannot be shipped to your selected delivery location. Please choose a different delivery location. (1)
1683839404,https://www.amazon.com/dp/1683839404/?aod=1,Books › Children's Books › Science Fiction & Fantasy,"Harry Potter: Christmas at Hogwarts: Magical Movie Moments (Movie Scrapbooks): Revenson, Jody: 9781683839408: Amazon.com: Books",
1978388926,https://www.amazon.com/dp/1978388926/?aod=1,Books › Romance › Contemporary,"Dirty Rich One Night Stand: Jones, Lisa Renee: 9781978388925: Amazon.com: Books",
B001FSJEYE,https://www.amazon.com/dp/B001FSJEYE/?aod=1,Grocery & Gourmet Food › Pantry Staples › Pasta & Noodles › Pasta,Amazon.com : De Cecco pasta orecchiette 500g (pack of 5) : Grocery & Gourmet Food,No button (0)
2820335225,https://www.amazon.com/dp/2820335225/?aod=1,Books › Comics & Graphic Novels › Manga,"Amazon.com: We Never Learn T03: 9782820335227: Tsutsui, Taichi: Books",
B08BKJCM3L,https://www.amazon.com/dp/B08BKJCM3L/?aod=1,Office Products › Office Electronics,"Amazon.com: Cosmo COPY STAND, Mini 100, to Digitize Pictures, Documents, Checks (for Deposit), Jewelries and Collectibles with Your Smartphone, Made in The USA : Office Products",No button (0)
B089GFW8GD,https://www.amazon.com/dp/B089GFW8GD/?aod=1,,"Amazon.com: Römer Wellness Compact Mirror, Stainless Steel : Beauty & Personal Care",No button (0)
B07WLMQ6KZ,https://www.amazon.com/dp/B07WLMQ6KZ/?aod=1,Movies & TV › Featured Categories › Blu-ray,"Amazon.com: Angel Heart : Mickey Rourke, Robert De Niro, Lisa Bonet, Charlotte Rampling, Stocker Fontelieu, Brownie McGhee, Michael Higgins, Elizabeth Whitcraft, Eliott Keener, Charles Gordone, Dann Florek, Kathleen Wilhoite, Alan Parker: Movies & TV",Not added (4)
B07Y5GWJK7,https://www.amazon.com/dp/B07Y5GWJK7/?aod=1,,Amazon.com: Light Up Anal Plug - Medium,No button (0)
B0000224PN,https://www.amazon.com/dp/B0000224PN/?aod=1,Tools & Home Improvement › Power & Hand Tools › Power Tools › Nailers & Staplers › Staplers › Construction Staplers,"BOSTITCH Flooring Stapler, Pneumatic, 1-1/2-Inch to 2-Inch (MIIIFS) - Power Construction Staplers - Amazon.com",Not added (1)
236188061X,https://www.amazon.com/dp/236188061X/?aod=1,Books › Religion & Spirituality › New Age & Spirituality,"L'Oracle des Déesses: Virtue, Doreen, Anfossi, Suzanne, Lamontagne, Lou: 9782361880613: Amazon.com: Books",Added (4)
B009NPLGOW,https://www.amazon.com/dp/B009NPLGOW/?aod=1,Automotive › Tires & Wheels › Accessories & Parts › Snow Chains › Car,"Amazon.com: KÖNIG CK-7 097 - Snow Chains, 2 Pieces : Automotive",This item cannot be shipped to your selected delivery location. Please choose a different delivery location. (1)
1455597295,https://www.amazon.com/dp/1455597295/?aod=1,Books › Literature & Fiction › Genre Fiction,"As the Devil Dares: Harrington, Anna: 9781455597291: Amazon.com: Books",
1529337046,https://www.amazon.com/dp/1529337046/?aod=1,Books › Business & Money › Business Culture,"Teams Unleashed: How to Release... by Sandahl, Phillip",
0359920691,https://www.amazon.com/dp/0359920691/?aod=1,,"Amazon.com: Break Every Chain: 9780359920693: Hardaway, Andréa: Books",
0996154507,https://www.amazon.com/dp/0996154507/?aod=1,,"Back To Us: Book 1: Roman, Teresa: 9780996154505: Amazon.com: Books",
0008467706,https://www.amazon.com/dp/0008467706/?aod=1,,"Sisters of Shadow (Sisters of Shadow, Book 1) (Sisters of Shadow): 9780008467708: Amazon.com: Books",
B003I39Q8I,https://www.amazon.com/dp/B003I39Q8I/?aod=1,Beauty & Personal Care › Makeup › Lips › Lipstick,Amazon.com : NYX PROFESSIONAL MAKEUP Extra Creamy Round Lipstick - B52 (Soft Mauve-Pink) : Beauty & Personal Care,Not added (1)
0953783960,https://www.amazon.com/dp/0953783960/?aod=1,Books › Humor & Entertainment › Pop Culture,"Vietnam Zippos: American Soldiers' Engravings and Stories (1965-1973): Buchanan, Sherry: 9780953783960: Amazon.com: Books",Not added (4)
B0159CTA7M,https://www.amazon.com/dp/B0159CTA7M/?aod=1,Baby Products › Baby Care › Grooming › Grooming & Healthcare Kits,Amazon.com: Event Travel Bag – 1 Pack : Baby,This item cannot be shipped to your selected delivery location. Please choose a different delivery location. (1)
B005J3HM7C,https://www.amazon.com/dp/B005J3HM7C/?aod=1,Stores › Food Service › Packaged Food & Snacks › Snacks › Mints,"Amazon.com: Mentos Rainbow Display mit 40 Rollen, 1er Pack (1 x 1.5 kg)",Not added (1)
B08P2DMBJG,https://www.amazon.com/dp/B08P2DMBJG/?aod=1,,"Amazon.com: Samsung Galaxy S21 Case, LED Wallet Cover - Black (US Version) : Cell Phones & Accessories",This item cannot be shipped to your selected delivery location. Please choose a different delivery location. (1)
1841466042,https://www.amazon.com/dp/1841466042/?aod=1,,"Standard Grade Biology Practice Papers - Credit Level: Parsons, Richard, Parsons, Richard: 9781841466040: Amazon.com: Books",This item cannot be shipped to your selected delivery location. Please choose a different delivery location. (1)
B07SQBCZ1F,https://www.amazon.com/dp/B07SQBCZ1F/?aod=1,"Health & Household › Vitamins, Minerals & Supplements › Collagen",Amazon.com: Forzagen Protein Powder for Women - Protein Shake With Collagen Powder for Women | High Protein Snacks And Collagen Supplement | Folic Acid | Hyaluronic Acid | Folic Acid | MCT oil | Collagen Peptides : Health & Household,Not added (1)
1974700526,https://www.amazon.com/dp/1974700526/?aod=1,,"Amazon.com: Demon Slayer: Kimetsu no Yaiba, Vol. 1 (1): 9781974700523: Gotouge, Koyoharu: Books",
1632152126,https://www.amazon.com/dp/1632152126/?aod=1,Books › Comics & Graphic Novels › Graphic Novels,"Amazon.com: Sunstone Volume 1: 9781632152121: Sejic, Stjepan, Sejic, Stjepan: Books",Not added (11)
0743266110,https://www.amazon.com/dp/0743266110/?aod=1,"Books › Mystery, Thriller & Suspense › Thrillers & Suspense","Conspirata: A Novel of Ancient Rome by Harris, Robert",
B07DGM7QBZ,https://www.amazon.com/dp/B07DGM7QBZ/?aod=1,Health & Household › Sexual Wellness › Safer Sex › Lubricants,"Amazon.com: Lube Life Water-Based Anal Lubricant, Personal Backdoor Lube for Men, Women and Couples, Non-Staining, 12 Fl Oz : Health & Household",Not added (1)
B019HZV6TM,https://www.amazon.com/dp/B019HZV6TM/?aod=1,,"Amazon.com: New Chapter Sleep Aid – Zyflamend Nighttime for Sleep Support with Turmeric + Valerian Root + Lemon Balm + Holy Basil, Vegetarian Capsules, 60 Count : Health & Household",No button (0)
1611804469,https://www.amazon.com/dp/1611804469/?aod=1,Books › Politics & Social Sciences › Philosophy,"The Alchemy of Freedom: The Philosophers'... by Almaas, A. H.",
1975643941,https://www.amazon.com/dp/1975643941/?aod=1,Books › Literature & Fiction › Erotica,"Amazon.com: Salvation: 9781975643942: Hardacre, Zak: Books",
1612969054,https://www.amazon.com/dp/1612969054/?aod=1,,"Wraith Lords of Zeiglon (War of the Staffs): Stephenson, Steve, Tedrick, K.M.: 9781612969053: Amazon.com: Books",
0262534789,https://www.amazon.com/dp/0262534789/?aod=1,,"Amazon.com: Using OpenMP-The Next Step: Affinity, Accelerators, Tasking, and SIMD (Scientific and Engineering Computation): 9780262534789: Van Der Pas, Ruud, Stotzer, Eric, Terboven, Christian: Books",
0373210744,https://www.amazon.com/dp/0373210744/?aod=1,Books › Teen & Young Adult › Science Fiction & Fantasy,"Amazon.com: The Iron Legends: Winter's PassageSummer's CrossingIron's Prophecy (The Iron Fey): 9780373210749: Kagawa, Julie, Kagawa, Julie, Kagawa, Julie: Books",
173483790X,https://www.amazon.com/dp/173483790X/?aod=1,,"This Shit Works: A No-Nonsense Guide to Networking Your Way to More Friends, More Adventures, and More Success: Brown, Julie, Brown, Julie: 9781734837902: Amazon.com: Books",
1442417390,https://www.amazon.com/dp/1442417390/?aod=1,Books › Teen & Young Adult › Science Fiction & Fantasy,"Amazon.com: Legacy: 9781442417397: Cochran, Molly: Books",
2911525736,https://www.amazon.com/dp/2911525736/?aod=1,,"Cartes divinatoires des Maîtres Ascensionnés: Virtue, Doreen: 9782911525735: Amazon.com: Books",
1302926829,https://www.amazon.com/dp/1302926829/?aod=1,Books › Comics & Graphic Novels › Graphic Novels,"Amazon.com: MARVEL COSMIC UNIVERSE BY DONNY CATES OMNIBUS VOL. 1 (Marvel Cosmic Universe Omnibus): 9781302926823: Cates, Donny, Marvel Various, Olivetti, Ariel, Marvel Various, Shaw, Geoff: Books",Added (2)
1421543168,https://www.amazon.com/dp/1421543168/?aod=1,,"RIN-NE, Vol. 8 (8): Takahashi, Rumiko: 9781421543161: Amazon.com: Books",
B004XTDVD2,https://www.amazon.com/dp/B004XTDVD2/?aod=1,,Amazon.com : Badshah Mumbai Bhaji Pav Masala - 100g : Mixed Spices And Seasonings : Grocery & Gourmet Food,No button (0)
B00HPTELHC,https://www.amazon.com/dp/B00HPTELHC/?aod=1,Electronics › Computers & Accessories › Computer Accessories & Peripherals › Cables & Accessories › Cables & Interconnects › SATA Cables,Amazon.com: Lineaire Male SATA Cable red 0m50 : Industrial & Scientific,This item cannot be shipped to your selected delivery location. Please choose a different delivery location. (1)
1594773149,https://www.amazon.com/dp/1594773149/?aod=1,,"Lingam Massage: Awakening Male Sexual Energy: Riedl, Michaela, Becker, Jürgen: 9781594773143: Amazon.com: Books",Not added (26)
B076BYM5HY,https://www.amazon.com/dp/B076BYM5HY/?aod=1,Health & Household › Healthcare,"Amazon.com: Je Joue G-Spot Bullet, Powerful, Whisper Quiet, USB Rechargeable, Waterproof, 100% Medical Grade Silicone - Purple : Health & Household",No button (0)
1512115444,https://www.amazon.com/dp/1512115444/?aod=1,Books › Religion & Spirituality › Occult & Paranormal,"Amazon.com: Remote Viewing UFOS and the VISITORS: Where do they come from? What are they? Who are they? Why are they here?: 9781512115444: Atunrase, Tunde, Smith Ph.D, Paul H.: Books",
1640094865,https://www.amazon.com/dp/1640094865/?aod=1,,"Nuclear Family: A Novel: Han, Joseph: 9781640094864: Amazon.com: Books",
B00BJ9USJ4,https://www.amazon.com/dp/B00BJ9USJ4/?aod=1,Grocery & Gourmet Food › Beverages › Coffee › Ground Coffee,"Amazon.com: Starbucks SBK11018192 Drip-Brewing Single Pot Portions Caffe Verona Ground Coffee Packets, Dark Roast (Pack of 18) : Grocery & Gourmet Food",Not added (1)
0373211252,https://www.amazon.com/dp/0373211252/?aod=1,Books › Teen & Young Adult › Science Fiction & Fantasy,"Amazon.com: Oceanborn (The Aquarathi) (English Edition): 9780373211258: Howard, Amalie: Books",
B07Y5L9WLP,https://www.amazon.com/dp/B07Y5L9WLP/?aod=1,,"Amazon.com: Nature's Truth Apple Cider Vinegar Gummies | 600 mg | 75 Gummies | Natural Apple Flavor | Vegan, Non-GMO, Gluten Free Supplement : Everything Else",Not added (2)
055779692X,https://www.amazon.com/dp/055779692X/?aod=1,,"Monologues and Scenes for Lesbian Actors: Revised and Expanded: Gage, Carolyn: 9780557796922: Amazon.com: Books",
1982002891,https://www.amazon.com/dp/1982002891/?aod=1,Books › Biographies & Memoirs › Memoirs,"Behind Closed Doors: My Darkest Days: Kasper, Kelly M: 9781982002893: Amazon.com: Books",
B00ENSGXY2,https://www.amazon.com/dp/B00ENSGXY2/?aod=1,,Amazon.com: BulkSupplements.com Spirulina Powder - Blue Green Algae - Spirulina Supplement - Green Powder Superfood Powder - Greens Supplements - Daily Greens Powder - 9g per Serving (500 Grams - 1.1 lbs) : Health & Household,No button (0)
0385516657,https://www.amazon.com/dp/0385516657/?aod=1,Books › History › World,"The Politics of Jesus: Rediscovering the True Revolutionary Nature of Jesus' Teachings and How They Have Been Corrupted: Hendricks Jr., Obery M.: 9780385516655: Amazon.com: Books",
B01GEOVQ0I,https://www.amazon.com/dp/B01GEOVQ0I/?aod=1,Grocery,Amazon.com : Clif Bars Clif Bar 12 x 68g - Almond Fudge by Clif Bar : Grocery & Gourmet Food,No button (0)
B08YYTXG15,https://www.amazon.com/dp/B08YYTXG15/?aod=1,Cell Phones & Accessories › Accessories › Automobile Accessories › Cradles,"Amazon.com: Beerte Car Phone Holder fit for Toyota Corolla 2020-2023,Corolla Cross 2022 2023,360 °Rotation Adjustable Car Air Vent,Auto Dashboard Cell Phone Mount fit for Any inches Mobile Phone (Magnet) : Cell Phones & Accessories",Not added (1)
1981528202,https://www.amazon.com/dp/1981528202/?aod=1,,"Why Can't I talk to Him about Sex?: A Journey to Your Heart Discovery Workbook: Ortiz, Mary Whitman: 9781981528202: Amazon.com: Books",
0785148736,https://www.amazon.com/dp/0785148736/?aod=1,Books › Comics & Graphic Novels › Graphic Novels,"Amazon.com: New Avengers, Vol. 1: 9780785148739: Bendis, Brian Michael, Immonen, Stuart: Books",Added (1)
0620719907,https://www.amazon.com/dp/0620719907/?aod=1,,"Travel The Planet Overland: Bell, Graeme Robert, Bell, Luisa, Bell, Luisa, Bell, Luisa, Bell, Graeme: 9780620719902: Amazon.com: Books",
0738743097,https://www.amazon.com/dp/0738743097/?aod=1,Books › Religion & Spirituality › New Age & Spirituality,"Whispers of Love Oracle: Oracle Cards for Attracting More Love into your Life: Hartfield, Angela, Wall, Josephine: 9780738743097: Amazon.com: Books",Not added (6)
B00T73ATFW,https://www.amazon.com/dp/B00T73ATFW/?aod=1,CDs & Vinyl › Pop › Dance Pop,Madonna - Rebel Heart - Amazon.com Music,
191113454X,https://www.amazon.com/dp/191113454X/?aod=1,,"Tarot Skills for the 21st Century: Mundane and Magical Divination: McCarthy, Josephine: 9781911134541: Amazon.com: Books",Not added (5)
B07RW3S7PK,https://www.amazon.com/dp/B07RW3S7PK/?aod=1,"Pet Supplies › Dogs › Collars, Harnesses & Leashes › Leashes › Retractable Leashes",Amazon.com : Happy & Polly 4 in 1 Dog Leash Retractable Dog Leash Heavy Duty 16.4 ft Dog Walking Leash with Flashlight Detachable/Protective Bungee Leash/Magic Box Dispenser Poop Bags for Small Medium Dogs : Pet Supplies,This item cannot be shipped to your selected delivery location. Please choose a different delivery location. (1)
194633541X,https://www.amazon.com/dp/194633541X/?aod=1,,"Amazon.com: Queen of Teeth: 9781946335418: Piper, Hailey: Books",Not added (10)
0593196805,https://www.amazon.com/dp/0593196805/?aod=1,,"The Healing Power of Witchcraft: A New Witch's Guide to Spells and Rituals: Rosenbriar, Meg: 9780593196809: Amazon.com: Books",Not added (11)
1937484610,https://www.amazon.com/dp/1937484610/?aod=1,,"Across Unstill Waters: The Stephenson House Chronicles: Book One: Andersen, D.L.: 9781937484613: Amazon.com: Books",
B00NTXLIE2,https://www.amazon.com/dp/B00NTXLIE2/?aod=1,Movies & TV › Featured Categories › Blu-ray,Amazon.com: El verdugo : Movies & TV,Not added (2)
B01N3SQ9DV,https://www.amazon.com/dp/B01N3SQ9DV/?aod=1,Beauty & Personal Care › Makeup › Lips › Lip Glosses,"Amazon.com : Burt's Bees 100% Natural Moisturizing Gloss Lip Crayon, Pink Lagoon - 1 Crayon : Beauty & Personal Care",No button (0)
0340571985,https://www.amazon.com/dp/0340571985/?aod=1,,Alle Einsteigen! (German Edition) - Amazon.com Music,This item cannot be shipped to your selected delivery location. Please choose a different delivery location. (1)
1250083265,https://www.amazon.com/dp/1250083265/?aod=1,,"Frank: A Life in Politics from the Great Society to Same-Sex Marriage: Frank, Barney: 9781250083265: Amazon.com: Books",Not added (11)
2361833921,https://www.amazon.com/dp/2361833921/?aod=1,Books › Foreign Language Books › French,"Amazon.com: LE LYS NOIR T.1: FAUSTINE: 9782361833923: LARZEM, FRANCOIS: Books",
0814439799,https://www.amazon.com/dp/0814439799/?aod=1,,"Raising Humans in a Digital World: Helping Kids Build a Healthy Relationship with Technology: Graber, Diana, Michele Borba: 9780814439791: Amazon.com: Books",No button (0)
B079PSX9SL,https://www.amazon.com/dp/B079PSX9SL/?aod=1,,Amazon.com: XConfessions Vol 10 (OmU) : Movies & TV,error
B07Y98NY6P,https://www.amazon.com/dp/B07Y98NY6P/?aod=1,,"Amazon.com: The Killer Inside T01 (1): 9791032705667: Inoryu, Hajime, Ponthaut, Alex, Ito, Shota: Books",
1604699620,https://www.amazon.com/dp/1604699620/?aod=1,,"Fearless Gardening: Be Bold, Break the Rules, and Grow What You Love: Bohl, Loree: 9781604699623: Amazon.com: Books",
1943164711,https://www.amazon.com/dp/1943164711/?aod=1,,"Find Your VOICE as a Leader: Larsen, Paul N: 9781943164714: Amazon.com: Books",
4864363684,https://www.amazon.com/dp/4864363684/?aod=1,Books › Foreign Language Books › Japanese,Amazon.com: セイ・ヘキ (ホットミルクコミックス 380): 9784864363686: Books,No button (0)
1542712378,https://www.amazon.com/dp/1542712378/?aod=1,,"The Perplexed Pumpkin (A Nick Williams Mystery): Butterfield, Frank W: 9781542712378: Amazon.com: Books",
4083331356,https://www.amazon.com/dp/4083331356/?aod=1,Books › Foreign Language Books › Japanese,"Amazon.com: Tachibana sakura no unmeibiuranai : ketteiban 2014: 9784083331350: editor: ToÌ„kyoÌ„ : ShuÌ„eisha, 2014.: Books",Added (1)
1421532956,https://www.amazon.com/dp/1421532956/?aod=1,Books › Comics & Graphic Novels › Manga,"Amazon.com: Inuyasha (VIZBIG Edition), Vol. 16 (16): 9781421532950: Takahashi, Rumiko: Books",
1561708771,https://www.amazon.com/dp/1561708771/?aod=1,Books › Politics & Social Sciences › Social Sciences,The Four Agreements: A 48-Card Deck: Don Miguel Ruiz: 9781561708772: Amazon.com: Books,
1947194607,https://www.amazon.com/dp/1947194607/?aod=1,Books › Teen & Young Adult › Literature & Fiction,"Amazon.com: Ajin 13: Demi-Human (Ajin: Demi-Human): 9781947194601: Sakurai, Gamon: Books",
B000I4JIK6,https://www.amazon.com/dp/B000I4JIK6/?aod=1,Video Games › Legacy Systems › PlayStation Systems › PlayStation 2 › Games,Amazon.com: Guitar Hero II: Game & Guitar Controller Bundle : Artist Not Provided: Video Games,
3969000041,https://www.amazon.com/dp/3969000041/?aod=1,,RUMORS OF WAR: Christoph Bangert: 9783969000045: Amazon.com: Books,Not added (7)
1520965761,https://www.amazon.com/dp/1520965761/?aod=1,,"THE FALL (Rapha Chronicles: Book 1) (The Rapha Chronicles): Keefer, Chana: 9781520965765: Amazon.com: Books",Added (1)
1484255836,https://www.amazon.com/dp/1484255836/?aod=1,,"MySQL 8 Query Performance Tuning: A Systematic Method for Improving Execution Speeds: Krogh, Jesper Wisborg: 9781484255834: Amazon.com: Books",
0785195106,https://www.amazon.com/dp/0785195106/?aod=1,,"Amazon.com: CAPTAIN AMERICA EPIC COLLECTION: MAN WITHOUT A COUNTRY (Epic Collection: Captain America): 9780785195108: Perrin, David, Garney, Ron, Waid, Mark, Messner-Loebs, Bill, Kavanagh, Terry: Books",Added (1)
B013NDK0G4,https://www.amazon.com/dp/B013NDK0G4/?aod=1,,Amazon.com : Ahlgrens Bilar ORIGINAL Swedish Chewy Candy Sweets Bag 125g. : Everything Else,Not added (2)
0738745510,https://www.amazon.com/dp/0738745510/?aod=1,Books › Religion & Spirituality › Occult & Paranormal,"Amazon.com: La Santa Muerte: Unearthing the Magic & Mysticism of Death: 9780738745510: Prower, Tomás: Books",
B00GW1MJ9G,https://www.amazon.com/dp/B00GW1MJ9G/?aod=1,Sports & Outdoors › Sports › Cycling › Bike Racks & Bags › Handlebar Bags,"Amazon.com : Brooks Saddles Pickwick Day Pack, Black/Black, 26 L : Sports & Outdoors",
1505411335,https://www.amazon.com/dp/1505411335/?aod=1,Books › Romance › Contemporary,"Ice (Regulators MC): Lane, Jessie, Camaron, Chelsea: 9781505411331: Amazon.com: Books",Added (1)
1542312272,https://www.amazon.com/dp/1542312272/?aod=1,Books › Arts & Photography › Other Media,"Color Me Horny: Schoenfeldt, Deena Rae: 9781542312271: Amazon.com: Books",No button (0)
B00HUC90A2,https://www.amazon.com/dp/B00HUC90A2/?aod=1,"Books › Health, Fitness & Dieting › Exercise & Fitness",Raja-Yoga: Swami Vivekananda: 9780911206234: Amazon.com: Books,Not added (7)
B003WOF4FC,https://www.amazon.com/dp/B003WOF4FC/?aod=1,Grocery & Gourmet Food › Breads & Bakery › Cookies,"Amazon.com: Walkers Shortbread Chocolate Chunk Biscuits, 1er Pack (1 x 150 g Karton) : Grocery & Gourmet Food",Not added (1)
B00JJHB04A,https://www.amazon.com/dp/B00JJHB04A/?aod=1,Home & Kitchen › Kitchen & Dining › Storage & Organization › Travel & To-Go Food Containers › Lunch Boxes,"Amazon.com: Signoraware New Classic Lunch Box with Bag Small, 550ml Mauve: Home & Kitchen",Not added (1)
2820325017,https://www.amazon.com/dp/2820325017/?aod=1,Books › Comics & Graphic Novels › Manga,"Amazon.com: Black Clover T02: 9782820325013: Tabata, Yuki: Books",
B0766C83GV,https://www.amazon.com/dp/B0766C83GV/?aod=1,Books › Comics & Graphic Novels › Manga,"Amazon.com: Im, Great Priest Imhotep, Tome 6 : 9791032702239: Morishita, Makoto, Lamodière, Fédoua: Books",Added (3)
0802128076,https://www.amazon.com/dp/0802128076/?aod=1,,"Open Me: Locascio, Lisa: 9780802128072: Amazon.com: Books",Not added (27)
B002NRB7SM,https://www.amazon.com/dp/B002NRB7SM/?aod=1,"Health & Household › Vitamins, Minerals & Supplements › Enzymes › Multi-Enzymes","Amazon.com: Enzymedica Digest Gold + Probiotics, 2-in-1 Advanced Formula, Supports Healthy Gut with 9 Different Probiotic Strains, Improves Digestion, 90 Capsules : Health & Household",No button (0)
0785154183,https://www.amazon.com/dp/0785154183/?aod=1,,"MILES MORALES: ULTIMATE SPIDER-MAN VOL. 2 - REVELATIONS: Marquez, David, Marquez, David, Bendis, Brian Michael: 9780785154181: Amazon.com: Books",Added (25)
B00I5FPQTM,https://www.amazon.com/dp/B00I5FPQTM/?aod=1,,Amazon.com: 閃乱カグラ2 -真紅- : Everything Else,Not added (2)
1720319197,https://www.amazon.com/dp/1720319197/?aod=1,Books › Christian Books & Bibles › Christian Living,"The Purpose of Freedom: How to untie soul ties and uproot strongholds: Eze, Joshua: 9781720319191: Amazon.com: Books",
B0053C8DRM,https://www.amazon.com/dp/B0053C8DRM/?aod=1,Movies & TV › Featured Categories › Blu-ray,Amazon.com: Fiebre del sábado noche : Movies & TV,Not added (2)
B009IV2Z7S,https://www.amazon.com/dp/B009IV2Z7S/?aod=1,Movies & TV › Genre for Featured Categories › Horror,"Amazon.com: Silent Night : Malcolm McDowell, Jaime King, Donal Logue, Ellen Wong, Brendan Fehr, Steven C. Miller: Movies & TV",
B0040319AS,https://www.amazon.com/dp/B0040319AS/?aod=1,Movies & TV › Featured Categories › DVD › Anime,"Amazon.com: RoboGeisha : Aya Kiguchi, Hitomi Hasebe, Noboru Iguchi: Movies & TV",No button (0)
1473659361,https://www.amazon.com/dp/1473659361/?aod=1,Books › Literature & Fiction › Genre Fiction,"The Deaths of December: A cracking Christmas crime thriller: Holliday, Susi: 9781473659360: Amazon.com: Books",
B01N9QPP12,https://www.amazon.com/dp/B01N9QPP12/?aod=1,Video Games › PlayStation 4,"Amazon.com: Phantastische Tierwesen und wo sie zu finden sind : Rowling, J. K., Howard, James Newton: Video Games",Not added (5)
1497640385,https://www.amazon.com/dp/1497640385/?aod=1,Books › Literature & Fiction › Action & Adventure,"Faery Lands Forlorn (A Man of His Word): Duncan, Dave: 9781497640382: Amazon.com: Books",
2841977706,https://www.amazon.com/dp/2841977706/?aod=1,Books › Religion & Spirituality › Occult & Paranormal,"Amazon.com: Entités diagnostic et rituels de bannissement - Pour libérer les personnes et les lieux: 9782841977703: Lechêne, Marie-Véronique: Books",
B00537P7L2,https://www.amazon.com/dp/B00537P7L2/?aod=1,Home & Kitchen › Kitchen & Dining › Cookware › Pots & Pans › Crepe Pans,"Amazon.com: Ancillary Range 25 cm Crepe/Pancake Pan, Multicolour, P675 : Home & Kitchen",This item cannot be shipped to your selected delivery location. Please choose a different delivery location. (1)
1490557067,https://www.amazon.com/dp/1490557067/?aod=1,Books › Science Fiction & Fantasy › Science Fiction,"Freedom's Scion (Spooner Federation Saga): Porretto, Francis W.: 9781490557069: Amazon.com: Books",
B001AZKB8K,https://www.amazon.com/dp/B001AZKB8K/?aod=1,Movies & TV › Featured Categories › DVD,"Amazon.com: Ken Park (Uncut Uncensored NTSC Region Free!) [DVD] Larry Clark : Amanda Plummer, Julio Oscar Mechoso, James Ransone, Larry Clark: Movies & TV",error
